[{"corso": "ARCHITETTURA", "week": 3, "month": "07", "year": 2022, "first_scorr": 0, "last_scorr": 0, "people_n": 415, "min_tot": 47.17, "matr": "F434380", "Unnamed: 0": 416456, "af user": null, "totale": 47.17, "matematica": null, "comp.del testo": null, "logica": null, "fisica": null, "corso di immatricolazione": null, "corso assegnato": "ARCHITETTURA", "corso prenotato": null, "corsi in lista di attesa": null, "esito": "ASSEGNATO", "uri": "http://didattica.polito.it/pls/portal30/preimma.pkg_grad.arc?p_data=29/07/2021&p_a_acc=2022", "conting": 0, "grad_n": 0, "date": "2021-07-29", "logica e matematica": null, "cultura generale": "6,00/9", "cultura del progetto": null, "territorio e soc.": null, "user": "F434380", "ragionamento logico": null, "storia": "4,10/9", "disegno e rappresentazione": "5,20/12", "matematica e fisica": "2,50/18", "corso/i in lista di attesa": null, "comprensione del testo": null, "fisica e matematica": null, "conoscenze acquisite negli studi": null, "corso unico": null, "conoscenze tecniche": null, "supercorso": "ARCHITETTURA"}, {"corso": "ARCHITETTURA", "week": 3, "month": "07", "year": 2023, "first_scorr": 0, "last_scorr": 0, "people_n": 417, "min_tot": 58.5, "matr": "F483773", "Unnamed: 0": 430543, "af user": null, "totale": 58.5, "matematica": null, "comp.del testo": null, "logica": null, "fisica": null, "corso di immatricolazione": null, "corso assegnato": "ARCHITETTURA", "corso prenotato": null, "corsi in lista di attesa": null, "esito": "ASSEGNATO", "uri": "http://didattica.polito.it/pls/portal30/preimma.pkg_grad.arc?p_data=29/07/2022&p_a_acc=2023", "conting": 0, "grad_n": 0, "date": "2022-07-29", "logica e matematica": null, "cultura generale": null, "cultura del progetto": null, "territorio e soc.": null, "user": "F483773", "ragionamento logico": "9,00/10", "storia": null, "disegno e rappresentazione": "8,00/10", "matematica e fisica": null, "corso/i in lista di attesa": null, "comprensione del testo": "9,00/10", "fisica e matematica": "0,25/10", "conoscenze acquisite negli studi": "3,00/10", "corso unico": null, "conoscenze tecniche": null, "supercorso": "ARCHITETTURA"}, {"corso": "ARCHITETTURA", "week": 0, "month": "08", "year": 2022, "first_scorr": 1, "last_scorr": 1, "people_n": 414, "min_tot": 37.0, "matr": "F437590", "Unnamed: 0": 417382, "af user": null, "totale": 37.0, "matematica": null, "comp.del testo": null, "logica": null, "fisica": null, "corso di immatricolazione": null, "corso assegnato": "ARCHITETTURA", "corso prenotato": null, "corsi in lista di attesa": null, "esito": "ASSEGNATO", "uri": "http://didattica.polito.it/pls/portal30/preimma.pkg_grad.arc?p_data=04/08/2021&p_a_acc=2022", "conting": 0, "grad_n": 1, "date": "2021-08-04", "logica e matematica": null, "cultura generale": "4,10/9", "cultura del progetto": null, "territorio e soc.": null, "user": "F437590", "ragionamento logico": null, "storia": "0,30/9", "disegno e rappresentazione": "6,70/12", "matematica e fisica": "2,50/18", "corso/i in lista di attesa": null, "comprensione del testo": null, "fisica e matematica": null, "conoscenze acquisite negli studi": null, "corso unico": null, "conoscenze tecniche": null, "supercorso": "ARCHITETTURA"}, {"corso": "ARCHITETTURA", "week": 0, "month": "08", "year": 2024, "first_scorr": 0, "last_scorr": 0, "people_n": 421, "min_tot": 57.5, "matr": "F532439", "Unnamed: 0": 456264, "af user": null, "totale": 57.5, "matematica": null, "comp.del testo": null, "logica": null, "fisica": null, "corso di immatricolazione": null, "corso assegnato": "ARCHITETTURA", "corso prenotato": null, "corsi in lista di attesa": null, "esito": "ASSEGNATO", "uri": "http://didattica.polito.it/pls/portal30/preimma.pkg_grad.arc?p_data=01/08/2023&p_a_acc=2024", "conting": 0, "grad_n": 0, "date": "2023-08-01", "logica e matematica": null, "cultura generale": null, "cultura del progetto": null, "territorio e soc.": null, "user": "F532439", "ragionamento logico": "8,75/10", "storia": null, "disegno e rappresentazione": "8,75/10", "matematica e fisica": null, "corso/i in lista di attesa": null, "comprensione del testo": "8,75/10", "fisica e matematica": "1,00/10", "conoscenze acquisite negli studi": "1,50/10", "corso unico": null, "conoscenze tecniche": null, "supercorso": "ARCHITETTURA"}, {"corso": "ARCHITETTURA", "week": 3, "month": "08", "year": 2022, "first_scorr": 2, "last_scorr": 3, "people_n": 797, "min_tot": 33.5, "matr": "F435679", "Unnamed: 0": 418991, "af user": null, "totale": 33.5, "matematica": null, "comp.del testo": null, "logica": null, "fisica": null, "corso di immatricolazione": null, "corso assegnato": "ARCHITETTURA", "corso prenotato": null, "corsi in lista di attesa": null, "esito": "ASSEGNATO", "uri": "http://didattica.polito.it/pls/portal30/preimma.pkg_grad.arc?p_data=27/08/2021&p_a_acc=2022", "conting": 0, "grad_n": 3, "date": "2021-08-27", "logica e matematica": null, "cultura generale": "4,10/9", "cultura del progetto": null, "territorio e soc.": null, "user": "F435679", "ragionamento logico": null, "storia": "4,10/9", "disegno e rappresentazione": "-0,80/12", "matematica e fisica": "2,20/18", "corso/i in lista di attesa": null, "comprensione del testo": null, "fisica e matematica": null, "conoscenze acquisite negli studi": null, "corso unico": null, "conoscenze tecniche": null, "supercorso": "ARCHITETTURA"}, {"corso": "ARCHITETTURA", "week": 3, "month": "08", "year": 2023, "first_scorr": 1, "last_scorr": 2, "people_n": 826, "min_tot": 53.5, "matr": "F485362", "Unnamed: 0": 432922, "af user": null, "totale": 53.5, "matematica": null, "comp.del testo": null, "logica": null, "fisica": null, "corso di immatricolazione": null, "corso assegnato": "ARCHITETTURA", "corso prenotato": null, "corsi in lista di attesa": null, "esito": "ASSEGNATO", "uri": "http://didattica.polito.it/pls/portal30/preimma.pkg_grad.arc?p_data=29/08/2022&p_a_acc=2023", "conting": 0, "grad_n": 2, "date": "2022-08-29", "logica e matematica": null, "cultura generale": null, "cultura del progetto": null, "territorio e soc.": null, "user": "F485362", "ragionamento logico": "7,75/10", "storia": null, "disegno e rappresentazione": "6,25/10", "matematica e fisica": null, "corso/i in lista di attesa": null, "comprensione del testo": "9,00/10", "fisica e matematica": "-0,50/10", "conoscenze acquisite negli studi": "4,25/10", "corso unico": null, "conoscenze tecniche": null, "supercorso": "ARCHITETTURA"}, {"corso": "ARCHITETTURA", "week": 3, "month": "08", "year": 2024, "first_scorr": 1, "last_scorr": 2, "people_n": 866, "min_tot": 52.0, "matr": "F537249", "Unnamed: 0": 459097, "af user": null, "totale": 52.0, "matematica": null, "comp.del testo": null, "logica": null, "fisica": null, "corso di immatricolazione": null, "corso assegnato": "ARCHITETTURA", "corso prenotato": null, "corsi in lista di attesa": null, "esito": "ASSEGNATO", "uri": "http://didattica.polito.it/pls/portal30/preimma.pkg_grad.arc?p_data=31/08/2023&p_a_acc=2024", "conting": 0, "grad_n": 2, "date": "2023-08-31", "logica e matematica": null, "cultura generale": null, "cultura del progetto": null, "territorio e soc.": null, "user": "F537249", "ragionamento logico": "8,75/10", "storia": null, "disegno e rappresentazione": "6,50/10", "matematica e fisica": null, "corso/i in lista di attesa": null, "comprensione del testo": "8,75/10", "fisica e matematica": "0,50/10", "conoscenze acquisite negli studi": "1,50/10", "corso unico": null, "conoscenze tecniche": null, "supercorso": "ARCHITETTURA"}, {"corso": "AER1T1", "week": 0, "month": "09", "year": 2018, "first_scorr": 0, "last_scorr": 0, "people_n": 116, "min_tot": 51.19, "matr": "F249876", "Unnamed: 0": 937, "af user": "F249876", "totale": 51.19, "matematica": "11.25", "comp.del testo": "2.25", "logica": "4.75", "fisica": "3.25", "corso di immatricolazione": null, "corso assegnato": "AER1T1", "corso prenotato": null, "corsi in lista di attesa": null, "esito": "ASSEGNATO", "uri": "http://didattica.polito.it/pls/portal30/preimma.pkg_grad.ing?p_data=05/09/2017&p_a_acc=2018", "conting": 0, "grad_n": 0, "date": "2017-09-05", "logica e matematica": null, "cultura generale": null, "cultura del progetto": null, "territorio e soc.": null, "user": null, "ragionamento logico": null, "storia": null, "disegno e rappresentazione": null, "matematica e fisica": null, "corso/i in lista di attesa": null, "comprensione del testo": null, "fisica e matematica": null, "conoscenze acquisite negli studi": null, "corso unico": null, "conoscenze tecniche": null, "supercorso": "INGEGNERIA"}, {"corso": "AER1T1", "week": 0, "month": "09", "year": 2019, "first_scorr": 0, "last_scorr": 0, "people_n": 106, "min_tot": 58.93, "matr": "F287471", "Unnamed: 0": 81726, "af user": "F287471", "totale": 58.93, "matematica": "14.25", "comp.del testo": "3.50", "logica": "4.75", "fisica": "2.25", "corso di immatricolazione": null, "corso assegnato": "AER1T1", "corso prenotato": null, "corsi in lista di attesa": null, "esito": "ASSEGNATO", "uri": "http://didattica.polito.it/pls/portal30/preimma.pkg_grad.ing?p_data=04/09/2018&p_a_acc=2019", "conting": 0, "grad_n": 0, "date": "2018-09-04", "logica e matematica": null, "cultura generale": null, "cultura del progetto": null, "territorio e soc.": null, "user": null, "ragionamento logico": null, "storia": null, "disegno e rappresentazione": null, "matematica e fisica": null, "corso/i in lista di attesa": null, "comprensione del testo": null, "fisica e matematica": null, "conoscenze acquisite negli studi": null, "corso unico": null, "conoscenze tecniche": null, "supercorso": "INGEGNERIA"}, {"corso": "AER1T1", "week": 0, "month": "09", "year": 2020, "first_scorr": 0, "last_scorr": 0, "people_n": 125, "min_tot": 56.55, "matr": "F321072", "Unnamed: 0": 205930, "af user": "F321072", "totale": 56.55, "matematica": "11.0", "comp.del testo": "3.50", "logica": "2.25", "fisica": "7.0", "corso di immatricolazione": null, "corso assegnato": null, "corso prenotato": "AER1T1", "corsi in lista di attesa": "INGEGNERIA BIOMEDICA", "esito": "PRENOTATO", "uri": "http://didattica.polito.it/pls/portal30/preimma.pkg_grad.ing?p_data=03/09/2019&p_a_acc=2020", "conting": 0, "grad_n": 0, "date": "2019-09-03", "logica e matematica": null, "cultura generale": null, "cultura del progetto": null, "territorio e soc.": null, "user": null, "ragionamento logico": null, "storia": null, "disegno e rappresentazione": null, "matematica e fisica": null, "corso/i in lista di attesa": null, "comprensione del testo": null, "fisica e matematica": null, "conoscenze acquisite negli studi": null, "corso unico": null, "conoscenze tecniche": null, "supercorso": "INGEGNERIA"}, {"corso": "AER1T1", "week": 0, "month": "09", "year": 2021, "first_scorr": 0, "last_scorr": 0, "people_n": 111, "min_tot": 60.12, "matr": "F373703", "Unnamed: 0": 301621, "af user": "F373703", "totale": 60.12, "matematica": "14.75", "comp.del testo": "2.50", "logica": "3.5", "fisica": "4.5", "corso di immatricolazione": null, "corso assegnato": "AER1T1", "corso prenotato": null, "corsi in lista di attesa": null, "esito": "ASSEGNATO", "uri": "http://didattica.polito.it/pls/portal30/preimma.pkg_grad.ing?p_data=01/09/2020&p_a_acc=2021", "conting": 0, "grad_n": 0, "date": "2020-09-01", "logica e matematica": null, "cultura generale": null, "cultura del progetto": null, "territorio e soc.": null, "user": null, "ragionamento logico": null, "storia": null, "disegno e rappresentazione": null, "matematica e fisica": null, "corso/i in lista di attesa": null, "comprensione del testo": null, "fisica e matematica": null, "conoscenze acquisite negli studi": null, "corso unico": null, "conoscenze tecniche": null, "supercorso": "INGEGNERIA"}, {"corso": "AER1T1", "week": 0, "month": "09", "year": 2022, "first_scorr": 0, "last_scorr": 0, "people_n": 381, "min_tot": 60.12, "matr": "F408431", "Unnamed: 0": 955, "af user": "F408431", "totale": 60.12, "matematica": "11,75", "comp.del testo": "5", "logica": "2,25", "fisica": "6,25", "corso di immatricolazione": null, "corso assegnato": null, "corso prenotato": null, "corsi in lista di attesa": null, "esito": "ASSEGNATO", "uri": "http://didattica.polito.it/pls/portal30/preimma.pkg_grad.ing_sep?p_data=07/09/2021&p_a_acc=2022&p_mnemo=AER1T1", "conting": 0, "grad_n": 0, "date": "2021-09-07", "logica e matematica": null, "cultura generale": null, "cultura del progetto": null, "territorio e soc.": null, "user": null, "ragionamento logico": null, "storia": null, "disegno e rappresentazione": null, "matematica e fisica": null, "corso/i in lista di attesa": null, "comprensione del testo": null, "fisica e matematica": null, "conoscenze acquisite negli studi": null, "corso unico": "AER1T1", "conoscenze tecniche": null, "supercorso": "INGEGNERIA"}, {"corso": "AER1T1", "week": 0, "month": "09", "year": 2023, "first_scorr": 0, "last_scorr": 0, "people_n": 425, "min_tot": 56.55, "matr": "F450218", "Unnamed: 0": 88377, "af user": "F450218", "totale": 56.55, "matematica": "11,5", "comp.del testo": "4", "logica": null, "fisica": "5,75", "corso di immatricolazione": null, "corso assegnato": null, "corso prenotato": null, "corsi in lista di attesa": null, "esito": "ASSEGNATO", "uri": "http://didattica.polito.it/pls/portal30/preimma.pkg_grad.ing_sep?p_data=06/09/2022&p_a_acc=2023&p_mnemo=AER1T1", "conting": 0, "grad_n": 0, "date": "2022-09-06", "logica e matematica": null, "cultura generale": null, "cultura del progetto": null, "territorio e soc.": null, "user": null, "ragionamento logico": null, "storia": null, "disegno e rappresentazione": null, "matematica e fisica": null, "corso/i in lista di attesa": null, "comprensione del testo": null, "fisica e matematica": null, "conoscenze acquisite negli studi": null, "corso unico": "AER1T1", "conoscenze tecniche": "2,5", "supercorso": "INGEGNERIA"}, {"corso": "AER1T1", "week": 0, "month": "09", "year": 2024, "first_scorr": 0, "last_scorr": 0, "people_n": 423, "min_tot": 59.52, "matr": "F503826", "Unnamed: 0": 185009, "af user": "F503826", "totale": 59.52, "matematica": "10,5", "comp.del testo": "6,75", "logica": null, "fisica": "3,75", "corso di immatricolazione": null, "corso assegnato": null, "corso prenotato": null, "corsi in lista di attesa": null, "esito": "ASSEGNATO", "uri": "http://didattica.polito.it/pls/portal30/preimma.pkg_grad.ing_sep?p_data=05/09/2023&p_a_acc=2024&p_mnemo=AER1T1", "conting": 0, "grad_n": 0, "date": "2023-09-05", "logica e matematica": null, "cultura generale": null, "cultura del progetto": null, "territorio e soc.": null, "user": null, "ragionamento logico": null, "storia": null, "disegno e rappresentazione": null, "matematica e fisica": null, "corso/i in lista di attesa": null, "comprensione del testo": null, "fisica e matematica": null, "conoscenze acquisite negli studi": null, "corso unico": "AER1T1", "conoscenze tecniche": "4", "supercorso": "INGEGNERIA"}, {"corso": "AMB1T1", "week": 0, "month": "09", "year": 2018, "first_scorr": 0, "last_scorr": 0, "people_n": 101, "min_tot": 34.52, "matr": "F257850", "Unnamed: 0": 3140, "af user": "F257850", "totale": 34.52, "matematica": "7.0", "comp.del testo": "1.00", "logica": "4.75", "fisica": "1.75", "corso di immatricolazione": null, "corso assegnato": "AMB1T1", "corso prenotato": null, "corsi in lista di attesa": null, "esito": "ASSEGNATO", "uri": "http://didattica.polito.it/pls/portal30/preimma.pkg_grad.ing?p_data=05/09/2017&p_a_acc=2018", "conting": 0, "grad_n": 0, "date": "2017-09-05", "logica e matematica": null, "cultura generale": null, "cultura del progetto": null, "territorio e soc.": null, "user": null, "ragionamento logico": null, "storia": null, "disegno e rappresentazione": null, "matematica e fisica": null, "corso/i in lista di attesa": null, "comprensione del testo": null, "fisica e matematica": null, "conoscenze acquisite negli studi": null, "corso unico": null, "conoscenze tecniche": null, "supercorso": "INGEGNERIA"}, {"corso": "AMB1T1", "week": 0, "month": "09", "year": 2019, "first_scorr": 0, "last_scorr": 0, "people_n": 109, "min_tot": 42.26, "matr": "F286556", "Unnamed: 0": 84252, "af user": "F286556", "totale": 42.26, "matematica": "11.75", "comp.del testo": "2.75", "logica": "1.75", "fisica": "1.5", "corso di immatricolazione": null, "corso assegnato": null, "corso prenotato": "AMB1T1", "corsi in lista di attesa": "INGEGNERIA ENERGETICA INGEGNERIA AEROSPAZIALE INGEGNERIA BIOMEDICA", "esito": "PRENOTATO", "uri": "http://didattica.polito.it/pls/portal30/preimma.pkg_grad.ing?p_data=04/09/2018&p_a_acc=2019", "conting": 0, "grad_n": 0, "date": "2018-09-04", "logica e matematica": null, "cultura generale": null, "cultura del progetto": null, "territorio e soc.": null, "user": null, "ragionamento logico": null, "storia": null, "disegno e rappresentazione": null, "matematica e fisica": null, "corso/i in lista di attesa": null, "comprensione del testo": null, "fisica e matematica": null, "conoscenze acquisite negli studi": null, "corso unico": null, "conoscenze tecniche": null, "supercorso": "INGEGNERIA"}, {"corso": "AMB1T1", "week": 0, "month": "09", "year": 2020, "first_scorr": 0, "last_scorr": 0, "people_n": 82, "min_tot": 45.24, "matr": "F325185", "Unnamed: 0": 207760, "af user": "F325185", "totale": 45.24, "matematica": "8.5", "comp.del testo": "5.00", "logica": "3.0", "fisica": "2.5", "corso di immatricolazione": null, "corso assegnato": "AMB1T1", "corso prenotato": null, "corsi in lista di attesa": null, "esito": "ASSEGNATO", "uri": "http://didattica.polito.it/pls/portal30/preimma.pkg_grad.ing?p_data=03/09/2019&p_a_acc=2020", "conting": 0, "grad_n": 0, "date": "2019-09-03", "logica e matematica": null, "cultura generale": null, "cultura del progetto": null, "territorio e soc.": null, "user": null, "ragionamento logico": null, "storia": null, "disegno e rappresentazione": null, "matematica e fisica": null, "corso/i in lista di attesa": null, "comprensione del testo": null, "fisica e matematica": null, "conoscenze acquisite negli studi": null, "corso unico": null, "conoscenze tecniche": null, "supercorso": "INGEGNERIA"}, {"corso": "AMB1T1", "week": 0, "month": "09", "year": 2021, "first_scorr": 0, "last_scorr": 0, "people_n": 128, "min_tot": 41.07, "matr": "F364933", "Unnamed: 0": 304269, "af user": "F364933", "totale": 41.07, "matematica": "9.25", "comp.del testo": "4.75", "logica": "0.5", "fisica": "2.75", "corso di immatricolazione": null, "corso assegnato": null, "corso prenotato": "AMB1T1", "corsi in lista di attesa": "INGEGNERIA GESTIONALE INGEGNERIA GESTIONALE INGEGNERIA BIOMEDICA INGEGNERIA INFORMATICA", "esito": "PRENOTATO", "uri": "http://didattica.polito.it/pls/portal30/preimma.pkg_grad.ing?p_data=01/09/2020&p_a_acc=2021", "conting": 0, "grad_n": 0, "date": "2020-09-01", "logica e matematica": null, "cultura generale": null, "cultura del progetto": null, "territorio e soc.": null, "user": null, "ragionamento logico": null, "storia": null, "disegno e rappresentazione": null, "matematica e fisica": null, "corso/i in lista di attesa": null, "comprensione del testo": null, "fisica e matematica": null, "conoscenze acquisite negli studi": null, "corso unico": null, "conoscenze tecniche": null, "supercorso": "INGEGNERIA"}, {"corso": "AMB1T1", "week": 0, "month": "09", "year": 2022, "first_scorr": 0, "last_scorr": 0, "people_n": 130, "min_tot": 41.07, "matr": "F407786", "Unnamed: 0": 81557, "af user": "F407786", "totale": 41.07, "matematica": "9,5", "comp.del testo": "2,25", "logica": "2,5", "fisica": "3", "corso di immatricolazione": null, "corso assegnato": null, "corso prenotato": null, "corsi in lista di attesa": null, "esito": "ASSEGNATO", "uri": "http://didattica.polito.it/pls/portal30/preimma.pkg_grad.ing_sep?p_data=07/09/2021&p_a_acc=2022&p_mnemo=AMB1T1", "conting": 0, "grad_n": 0, "date": "2021-09-07", "logica e matematica": null, "cultura generale": null, "cultura del progetto": null, "territorio e soc.": null, "user": null, "ragionamento logico": null, "storia": null, "disegno e rappresentazione": null, "matematica e fisica": null, "corso/i in lista di attesa": null, "comprensione del testo": null, "fisica e matematica": null, "conoscenze acquisite negli studi": null, "corso unico": "AMB1T1", "conoscenze tecniche": null, "supercorso": "INGEGNERIA"}, {"corso": "AMB1T1", "week": 0, "month": "09", "year": 2023, "first_scorr": 0, "last_scorr": 0, "people_n": 155, "min_tot": 33.93, "matr": "F475370", "Unnamed: 0": 177567, "af user": "F475370", "totale": 33.93, "matematica": "6,75", "comp.del testo": "6,75", "logica": null, "fisica": "1,25", "corso di immatricolazione": null, "corso assegnato": null, "corso prenotato": null, "corsi in lista di attesa": null, "esito": "PRENOTATO", "uri": "http://didattica.polito.it/pls/portal30/preimma.pkg_grad.ing_sep?p_data=06/09/2022&p_a_acc=2023&p_mnemo=AMB1T1", "conting": 0, "grad_n": 0, "date": "2022-09-06", "logica e matematica": null, "cultura generale": null, "cultura del progetto": null, "territorio e soc.": null, "user": null, "ragionamento logico": null, "storia": null, "disegno e rappresentazione": null, "matematica e fisica": null, "corso/i in lista di attesa": null, "comprensione del testo": null, "fisica e matematica": null, "conoscenze acquisite negli studi": null, "corso unico": "AMB1T1", "conoscenze tecniche": "-0,5", "supercorso": "INGEGNERIA"}, {"corso": "AMB1T1", "week": 0, "month": "09", "year": 2024, "first_scorr": 0, "last_scorr": 0, "people_n": 150, "min_tot": 36.31, "matr": "F498376", "Unnamed: 0": 264314, "af user": "F498376", "totale": 36.31, "matematica": "7", "comp.del testo": "6,75", "logica": null, "fisica": "-0,25", "corso di immatricolazione": null, "corso assegnato": null, "corso prenotato": null, "corsi in lista di attesa": null, "esito": "ASSEGNATO", "uri": "http://didattica.polito.it/pls/portal30/preimma.pkg_grad.ing_sep?p_data=05/09/2023&p_a_acc=2024&p_mnemo=AMB1T1", "conting": 0, "grad_n": 0, "date": "2023-09-05", "logica e matematica": null, "cultura generale": null, "cultura del progetto": null, "territorio e soc.": null, "user": null, "ragionamento logico": null, "storia": null, "disegno e rappresentazione": null, "matematica e fisica": null, "corso/i in lista di attesa": null, "comprensione del testo": null, "fisica e matematica": null, "conoscenze acquisite negli studi": null, "corso unico": "AMB1T1", "conoscenze tecniche": "1,75", "supercorso": "INGEGNERIA"}, {"corso": "ARCHITETTURA", "week": 0, "month": "09", "year": 2022, "first_scorr": 4, "last_scorr": 5, "people_n": 812, "min_tot": 33.5, "matr": "F439012", "Unnamed: 0": 419762, "af user": null, "totale": 33.5, "matematica": null, "comp.del testo": null, "logica": null, "fisica": null, "corso di immatricolazione": null, "corso assegnato": "ARCHITETTURA", "corso prenotato": null, "corsi in lista di attesa": null, "esito": "ASSEGNATO", "uri": "http://didattica.polito.it/pls/portal30/preimma.pkg_grad.arc?p_data=01/09/2021&p_a_acc=2022", "conting": 0, "grad_n": 4, "date": "2021-09-01", "logica e matematica": null, "cultura generale": "3,30/9", "cultura del progetto": null, "territorio e soc.": null, "user": "F439012", "ragionamento logico": null, "storia": "5,20/9", "disegno e rappresentazione": "2,50/12", "matematica e fisica": "2,80/18", "corso/i in lista di attesa": null, "comprensione del testo": null, "fisica e matematica": null, "conoscenze acquisite negli studi": null, "corso unico": null, "conoscenze tecniche": null, "supercorso": "ARCHITETTURA"}, {"corso": "ARCHITETTURA", "week": 0, "month": "09", "year": 2023, "first_scorr": 3, "last_scorr": 4, "people_n": 823, "min_tot": 52.5, "matr": "F485508", "Unnamed: 0": 435144, "af user": null, "totale": 52.5, "matematica": null, "comp.del testo": null, "logica": null, "fisica": null, "corso di immatricolazione": null, "corso assegnato": "ARCHITETTURA", "corso prenotato": null, "corsi in lista di attesa": null, "esito": "ASSEGNATO", "uri": "http://didattica.polito.it/pls/portal30/preimma.pkg_grad.arc?p_data=06/09/2022&p_a_acc=2023", "conting": 0, "grad_n": 4, "date": "2022-09-06", "logica e matematica": null, "cultura generale": null, "cultura del progetto": null, "territorio e soc.": null, "user": "F485508", "ragionamento logico": "7,75/10", "storia": null, "disegno e rappresentazione": "5,75/10", "matematica e fisica": null, "corso/i in lista di attesa": null, "comprensione del testo": "6,25/10", "fisica e matematica": "1,75/10", "conoscenze acquisite negli studi": "4,75/10", "corso unico": null, "conoscenze tecniche": null, "supercorso": "ARCHITETTURA"}, {"corso": "ARCHITETTURA", "week": 0, "month": "09", "year": 2024, "first_scorr": 3, "last_scorr": 3, "people_n": 424, "min_tot": 51.5, "matr": "F533952", "Unnamed: 0": 460425, "af user": null, "totale": 51.5, "matematica": null, "comp.del testo": null, "logica": null, "fisica": null, "corso di immatricolazione": null, "corso assegnato": "ARCHITETTURA", "corso prenotato": null, "corsi in lista di attesa": null, "esito": "ASSEGNATO", "uri": "http://didattica.polito.it/pls/portal30/preimma.pkg_grad.arc?p_data=06/09/2023&p_a_acc=2024", "conting": 0, "grad_n": 3, "date": "2023-09-06", "logica e matematica": null, "cultura generale": null, "cultura del progetto": null, "territorio e soc.": null, "user": "F533952", "ragionamento logico": "10,00/10", "storia": null, "disegno e rappresentazione": "6,00/10", "matematica e fisica": null, "corso/i in lista di attesa": null, "comprensione del testo": "8,75/10", "fisica e matematica": "0,50/10", "conoscenze acquisite negli studi": "0,50/10", "corso unico": null, "conoscenze tecniche": null, "supercorso": "ARCHITETTURA"}, {"corso": "AUT1T1", "week": 0, "month": "09", "year": 2018, "first_scorr": 0, "last_scorr": 0, "people_n": 89, "min_tot": 43.45, "matr": "F246895", "Unnamed: 0": 1983, "af user": "F246895", "totale": 43.45, "matematica": "9.75", "comp.del testo": "4.75", "logica": "1.0", "fisica": "2.75", "corso di immatricolazione": null, "corso assegnato": "AUT1T1", "corso prenotato": null, "corsi in lista di attesa": null, "esito": "ASSEGNATO", "uri": "http://didattica.polito.it/pls/portal30/preimma.pkg_grad.ing?p_data=05/09/2017&p_a_acc=2018", "conting": 0, "grad_n": 0, "date": "2017-09-05", "logica e matematica": null, "cultura generale": null, "cultura del progetto": null, "territorio e soc.": null, "user": null, "ragionamento logico": null, "storia": null, "disegno e rappresentazione": null, "matematica e fisica": null, "corso/i in lista di attesa": null, "comprensione del testo": null, "fisica e matematica": null, "conoscenze acquisite negli studi": null, "corso unico": null, "conoscenze tecniche": null, "supercorso": "INGEGNERIA"}, {"corso": "AUT1T1", "week": 0, "month": "09", "year": 2019, "first_scorr": 0, "last_scorr": 0, "people_n": 105, "min_tot": 50.0, "matr": "F286037", "Unnamed: 0": 82999, "af user": "F286037", "totale": 50.0, "matematica": "10.0", "comp.del testo": "4.00", "logica": "6.0", "fisica": "1.0", "corso di immatricolazione": null, "corso assegnato": "AUT1T1", "corso prenotato": null, "corsi in lista di attesa": null, "esito": "ASSEGNATO", "uri": "http://didattica.polito.it/pls/portal30/preimma.pkg_grad.ing?p_data=04/09/2018&p_a_acc=2019", "conting": 0, "grad_n": 0, "date": "2018-09-04", "logica e matematica": null, "cultura generale": null, "cultura del progetto": null, "territorio e soc.": null, "user": null, "ragionamento logico": null, "storia": null, "disegno e rappresentazione": null, "matematica e fisica": null, "corso/i in lista di attesa": null, "comprensione del testo": null, "fisica e matematica": null, "conoscenze acquisite negli studi": null, "corso unico": null, "conoscenze tecniche": null, "supercorso": "INGEGNERIA"}, {"corso": "AUT1T1", "week": 0, "month": "09", "year": 2020, "first_scorr": 0, "last_scorr": 0, "people_n": 130, "min_tot": 48.81, "matr": "F324384", "Unnamed: 0": 207139, "af user": "F324384", "totale": 48.81, "matematica": "11.25", "comp.del testo": "2.25", "logica": "1.75", "fisica": "5.25", "corso di immatricolazione": null, "corso assegnato": "AUT1T1", "corso prenotato": null, "corsi in lista di attesa": null, "esito": "ASSEGNATO", "uri": "http://didattica.polito.it/pls/portal30/preimma.pkg_grad.ing?p_data=03/09/2019&p_a_acc=2020", "conting": 0, "grad_n": 0, "date": "2019-09-03", "logica e matematica": null, "cultura generale": null, "cultura del progetto": null, "territorio e soc.": null, "user": null, "ragionamento logico": null, "storia": null, "disegno e rappresentazione": null, "matematica e fisica": null, "corso/i in lista di attesa": null, "comprensione del testo": null, "fisica e matematica": null, "conoscenze acquisite negli studi": null, "corso unico": null, "conoscenze tecniche": null, "supercorso": "INGEGNERIA"}, {"corso": "AUT1T1", "week": 0, "month": "09", "year": 2021, "first_scorr": 0, "last_scorr": 0, "people_n": 124, "min_tot": 47.62, "matr": "F397936", "Unnamed: 0": 303405, "af user": "F397936", "totale": 47.62, "matematica": "8.25", "comp.del testo": "3.50", "logica": "3.75", "fisica": "4.5", "corso di immatricolazione": null, "corso assegnato": null, "corso prenotato": "AUT1T1", "corsi in lista di attesa": "INGEGNERIA AEROSPAZIALE", "esito": "PRENOTATO", "uri": "http://didattica.polito.it/pls/portal30/preimma.pkg_grad.ing?p_data=01/09/2020&p_a_acc=2021", "conting": 0, "grad_n": 0, "date": "2020-09-01", "logica e matematica": null, "cultura generale": null, "cultura del progetto": null, "territorio e soc.": null, "user": null, "ragionamento logico": null, "storia": null, "disegno e rappresentazione": null, "matematica e fisica": null, "corso/i in lista di attesa": null, "comprensione del testo": null, "fisica e matematica": null, "conoscenze acquisite negli studi": null, "corso unico": null, "conoscenze tecniche": null, "supercorso": "INGEGNERIA"}, {"corso": "AUT1T1", "week": 0, "month": "09", "year": 2022, "first_scorr": 0, "last_scorr": 0, "people_n": 154, "min_tot": 50.6, "matr": "F435031", "Unnamed: 0": 28653, "af user": "F435031", "totale": 50.6, "matematica": "9", "comp.del testo": "4,75", "logica": "2,5", "fisica": "5", "corso di immatricolazione": null, "corso assegnato": null, "corso prenotato": null, "corsi in lista di attesa": null, "esito": "ASSEGNATO", "uri": "http://didattica.polito.it/pls/portal30/preimma.pkg_grad.ing_sep?p_data=07/09/2021&p_a_acc=2022&p_mnemo=AUT1T1", "conting": 0, "grad_n": 0, "date": "2021-09-07", "logica e matematica": null, "cultura generale": null, "cultura del progetto": null, "territorio e soc.": null, "user": null, "ragionamento logico": null, "storia": null, "disegno e rappresentazione": null, "matematica e fisica": null, "corso/i in lista di attesa": null, "comprensione del testo": null, "fisica e matematica": null, "conoscenze acquisite negli studi": null, "corso unico": "AUT1T1", "conoscenze tecniche": null, "supercorso": "INGEGNERIA"}, {"corso": "AUT1T1", "week": 0, "month": "09", "year": 2023, "first_scorr": 0, "last_scorr": 0, "people_n": 189, "min_tot": 47.02, "matr": "F445720", "Unnamed: 0": 116849, "af user": "F445720", "totale": 47.02, "matematica": "8,5", "comp.del testo": "6,5", "logica": null, "fisica": "1", "corso di immatricolazione": null, "corso assegnato": null, "corso prenotato": null, "corsi in lista di attesa": null, "esito": "ASSEGNATO", "uri": "http://didattica.polito.it/pls/portal30/preimma.pkg_grad.ing_sep?p_data=06/09/2022&p_a_acc=2023&p_mnemo=AUT1T1", "conting": 0, "grad_n": 0, "date": "2022-09-06", "logica e matematica": null, "cultura generale": null, "cultura del progetto": null, "territorio e soc.": null, "user": null, "ragionamento logico": null, "storia": null, "disegno e rappresentazione": null, "matematica e fisica": null, "corso/i in lista di attesa": null, "comprensione del testo": null, "fisica e matematica": null, "conoscenze acquisite negli studi": null, "corso unico": "AUT1T1", "conoscenze tecniche": "3,75", "supercorso": "INGEGNERIA"}, {"corso": "AUT1T1", "week": 0, "month": "09", "year": 2024, "first_scorr": 0, "last_scorr": 0, "people_n": 164, "min_tot": 52.98, "matr": "F495403", "Unnamed: 0": 210081, "af user": "F495403", "totale": 52.98, "matematica": "10,25", "comp.del testo": "7,75", "logica": null, "fisica": "1,25", "corso di immatricolazione": null, "corso assegnato": null, "corso prenotato": null, "corsi in lista di attesa": null, "esito": "PRENOTATO", "uri": "http://didattica.polito.it/pls/portal30/preimma.pkg_grad.ing_sep?p_data=05/09/2023&p_a_acc=2024&p_mnemo=AUT1T1", "conting": 0, "grad_n": 0, "date": "2023-09-05", "logica e matematica": null, "cultura generale": null, "cultura del progetto": null, "territorio e soc.": null, "user": null, "ragionamento logico": null, "storia": null, "disegno e rappresentazione": null, "matematica e fisica": null, "corso/i in lista di attesa": null, "comprensione del testo": null, "fisica e matematica": null, "conoscenze acquisite negli studi": null, "corso unico": "AUT1T1", "conoscenze tecniche": "3", "supercorso": "INGEGNERIA"}, {"corso": "BIO1T1", "week": 0, "month": "09", "year": 2018, "first_scorr": 0, "last_scorr": 0, "people_n": 213, "min_tot": 47.02, "matr": "F257339", "Unnamed: 0": 1484, "af user": "F257339", "totale": 47.02, "matematica": "11.0", "comp.del testo": "2.75", "logica": "2.75", "fisica": "3.25", "corso di immatricolazione": null, "corso assegnato": "BIO1T1", "corso prenotato": null, "corsi in lista di attesa": null, "esito": "ASSEGNATO", "uri": "http://didattica.polito.it/pls/portal30/preimma.pkg_grad.ing?p_data=05/09/2017&p_a_acc=2018", "conting": 0, "grad_n": 0, "date": "2017-09-05", "logica e matematica": null, "cultura generale": null, "cultura del progetto": null, "territorio e soc.": null, "user": null, "ragionamento logico": null, "storia": null, "disegno e rappresentazione": null, "matematica e fisica": null, "corso/i in lista di attesa": null, "comprensione del testo": null, "fisica e matematica": null, "conoscenze acquisite negli studi": null, "corso unico": null, "conoscenze tecniche": null, "supercorso": "INGEGNERIA"}, {"corso": "BIO1T1", "week": 0, "month": "09", "year": 2019, "first_scorr": 0, "last_scorr": 0, "people_n": 223, "min_tot": 54.17, "matr": "F290954", "Unnamed: 0": 82357, "af user": "F290954", "totale": 54.17, "matematica": "14.25", "comp.del testo": "3.50", "logica": "2.5", "fisica": "2.5", "corso di immatricolazione": null, "corso assegnato": null, "corso prenotato": "BIO1T1", "corsi in lista di attesa": "INGEGNERIA AEROSPAZIALE", "esito": "PRENOTATO", "uri": "http://didattica.polito.it/pls/portal30/preimma.pkg_grad.ing?p_data=04/09/2018&p_a_acc=2019", "conting": 0, "grad_n": 0, "date": "2018-09-04", "logica e matematica": null, "cultura generale": null, "cultura del progetto": null, "territorio e soc.": null, "user": null, "ragionamento logico": null, "storia": null, "disegno e rappresentazione": null, "matematica e fisica": null, "corso/i in lista di attesa": null, "comprensione del testo": null, "fisica e matematica": null, "conoscenze acquisite negli studi": null, "corso unico": null, "conoscenze tecniche": null, "supercorso": "INGEGNERIA"}, {"corso": "BIO1T1", "week": 0, "month": "09", "year": 2020, "first_scorr": 0, "last_scorr": 0, "people_n": 205, "min_tot": 56.55, "matr": "F322986", "Unnamed: 0": 205906, "af user": "F322986", "totale": 56.55, "matematica": "15.5", "comp.del testo": "4.75", "logica": "3.5", "fisica": "0.0", "corso di immatricolazione": null, "corso assegnato": "BIO1T1", "corso prenotato": null, "corsi in lista di attesa": null, "esito": "ASSEGNATO", "uri": "http://didattica.polito.it/pls/portal30/preimma.pkg_grad.ing?p_data=03/09/2019&p_a_acc=2020", "conting": 0, "grad_n": 0, "date": "2019-09-03", "logica e matematica": null, "cultura generale": null, "cultura del progetto": null, "territorio e soc.": null, "user": null, "ragionamento logico": null, "storia": null, "disegno e rappresentazione": null, "matematica e fisica": null, "corso/i in lista di attesa": null, "comprensione del testo": null, "fisica e matematica": null, "conoscenze acquisite negli studi": null, "corso unico": null, "conoscenze tecniche": null, "supercorso": "INGEGNERIA"}, {"corso": "BIO1T1", "week": 0, "month": "09", "year": 2021, "first_scorr": 0, "last_scorr": 0, "people_n": 158, "min_tot": 58.33, "matr": "F392032", "Unnamed: 0": 301824, "af user": "F392032", "totale": 58.33, "matematica": "16.0", "comp.del testo": "4.75", "logica": "1.75", "fisica": "2.0", "corso di immatricolazione": null, "corso assegnato": "BIO1T1", "corso prenotato": null, "corsi in lista di attesa": null, "esito": "ASSEGNATO", "uri": "http://didattica.polito.it/pls/portal30/preimma.pkg_grad.ing?p_data=01/09/2020&p_a_acc=2021", "conting": 0, "grad_n": 0, "date": "2020-09-01", "logica e matematica": null, "cultura generale": null, "cultura del progetto": null, "territorio e soc.": null, "user": null, "ragionamento logico": null, "storia": null, "disegno e rappresentazione": null, "matematica e fisica": null, "corso/i in lista di attesa": null, "comprensione del testo": null, "fisica e matematica": null, "conoscenze acquisite negli studi": null, "corso unico": null, "conoscenze tecniche": null, "supercorso": "INGEGNERIA"}, {"corso": "BIO1T1", "week": 0, "month": "09", "year": 2022, "first_scorr": 0, "last_scorr": 0, "people_n": 330, "min_tot": 57.74, "matr": "F417824", "Unnamed: 0": 9496, "af user": "F417824", "totale": 57.74, "matematica": "15", "comp.del testo": "1,75", "logica": "4,75", "fisica": "2,75", "corso di immatricolazione": null, "corso assegnato": null, "corso prenotato": null, "corsi in lista di attesa": null, "esito": "ASSEGNATO", "uri": "http://didattica.polito.it/pls/portal30/preimma.pkg_grad.ing_sep?p_data=07/09/2021&p_a_acc=2022&p_mnemo=BIO1T1", "conting": 0, "grad_n": 0, "date": "2021-09-07", "logica e matematica": null, "cultura generale": null, "cultura del progetto": null, "territorio e soc.": null, "user": null, "ragionamento logico": null, "storia": null, "disegno e rappresentazione": null, "matematica e fisica": null, "corso/i in lista di attesa": null, "comprensione del testo": null, "fisica e matematica": null, "conoscenze acquisite negli studi": null, "corso unico": "BIO1T1", "conoscenze tecniche": null, "supercorso": "INGEGNERIA"}, {"corso": "BIO1T1", "week": 0, "month": "09", "year": 2023, "first_scorr": 0, "last_scorr": 0, "people_n": 400, "min_tot": 49.4, "matr": "F456161", "Unnamed: 0": 96959, "af user": "F456161", "totale": 49.4, "matematica": "10,5", "comp.del testo": "3", "logica": null, "fisica": "7,5", "corso di immatricolazione": null, "corso assegnato": null, "corso prenotato": null, "corsi in lista di attesa": null, "esito": "ASSEGNATO", "uri": "http://didattica.polito.it/pls/portal30/preimma.pkg_grad.ing_sep?p_data=06/09/2022&p_a_acc=2023&p_mnemo=BIO1T1", "conting": 0, "grad_n": 0, "date": "2022-09-06", "logica e matematica": null, "cultura generale": null, "cultura del progetto": null, "territorio e soc.": null, "user": null, "ragionamento logico": null, "storia": null, "disegno e rappresentazione": null, "matematica e fisica": null, "corso/i in lista di attesa": null, "comprensione del testo": null, "fisica e matematica": null, "conoscenze acquisite negli studi": null, "corso unico": "BIO1T1", "conoscenze tecniche": "-0,25", "supercorso": "INGEGNERIA"}, {"corso": "BIO1T1", "week": 0, "month": "09", "year": 2024, "first_scorr": 0, "last_scorr": 0, "people_n": 403, "min_tot": 51.79, "matr": "F517130", "Unnamed: 0": 192498, "af user": "F517130", "totale": 51.79, "matematica": "11,75", "comp.del testo": "5,75", "logica": null, "fisica": "1,5", "corso di immatricolazione": null, "corso assegnato": null, "corso prenotato": null, "corsi in lista di attesa": null, "esito": "ASSEGNATO", "uri": "http://didattica.polito.it/pls/portal30/preimma.pkg_grad.ing_sep?p_data=05/09/2023&p_a_acc=2024&p_mnemo=BIO1T1", "conting": 0, "grad_n": 0, "date": "2023-09-05", "logica e matematica": null, "cultura generale": null, "cultura del progetto": null, "territorio e soc.": null, "user": null, "ragionamento logico": null, "storia": null, "disegno e rappresentazione": null, "matematica e fisica": null, "corso/i in lista di attesa": null, "comprensione del testo": null, "fisica e matematica": null, "conoscenze acquisite negli studi": null, "corso unico": "BIO1T1", "conoscenze tecniche": "2,75", "supercorso": "INGEGNERIA"}, {"corso": "CEE1T1", "week": 0, "month": "09", "year": 2023, "first_scorr": 0, "last_scorr": 0, "people_n": 33, "min_tot": 20.24, "matr": "F478166", "Unnamed: 0": 86552, "af user": "F478166", "totale": 20.24, "matematica": "1,25", "comp.del testo": "2,75", "logica": null, "fisica": "1,75", "corso di immatricolazione": null, "corso assegnato": null, "corso prenotato": null, "corsi in lista di attesa": null, "esito": "PRENOTATO", "uri": "http://didattica.polito.it/pls/portal30/preimma.pkg_grad.ing_sep?p_data=06/09/2022&p_a_acc=2023&p_mnemo=CEE1T1", "conting": 0, "grad_n": 0, "date": "2022-09-06", "logica e matematica": null, "cultura generale": null, "cultura del progetto": null, "territorio e soc.": null, "user": null, "ragionamento logico": null, "storia": null, "disegno e rappresentazione": null, "matematica e fisica": null, "corso/i in lista di attesa": null, "comprensione del testo": null, "fisica e matematica": null, "conoscenze acquisite negli studi": null, "corso unico": "CEE1T1", "conoscenze tecniche": "2,75", "supercorso": "INGEGNERIA"}, {"corso": "CEE1T1", "week": 0, "month": "09", "year": 2024, "first_scorr": 0, "last_scorr": 0, "people_n": 14, "min_tot": 55.95, "matr": "F534695", "Unnamed: 0": 183387, "af user": "F534695", "totale": 55.95, "matematica": "5,25", "comp.del testo": "8,75", "logica": null, "fisica": "4,5", "corso di immatricolazione": null, "corso assegnato": null, "corso prenotato": null, "corsi in lista di attesa": null, "esito": "ASSEGNATO", "uri": "http://didattica.polito.it/pls/portal30/preimma.pkg_grad.ing_sep?p_data=05/09/2023&p_a_acc=2024&p_mnemo=CEE1T1", "conting": 0, "grad_n": 0, "date": "2023-09-05", "logica e matematica": null, "cultura generale": null, "cultura del progetto": null, "territorio e soc.": null, "user": null, "ragionamento logico": null, "storia": null, "disegno e rappresentazione": null, "matematica e fisica": null, "corso/i in lista di attesa": null, "comprensione del testo": null, "fisica e matematica": null, "conoscenze acquisite negli studi": null, "corso unico": "CEE1T1", "conoscenze tecniche": "5", "supercorso": "INGEGNERIA"}, {"corso": "CHI1T1", "week": 0, "month": "09", "year": 2018, "first_scorr": 0, "last_scorr": 0, "people_n": 130, "min_tot": 39.29, "matr": "F258612", "Unnamed: 0": 2579, "af user": "F258612", "totale": 39.29, "matematica": "10.75", "comp.del testo": "1.50", "logica": "3.0", "fisica": "1.25", "corso di immatricolazione": null, "corso assegnato": null, "corso prenotato": "CHI1T1", "corsi in lista di attesa": "INGEGNERIA INFORMATICA MATEMATICA PER L'INGEGNERIA INGEGNERIA MECCANICA", "esito": "PRENOTATO", "uri": "http://didattica.polito.it/pls/portal30/preimma.pkg_grad.ing?p_data=05/09/2017&p_a_acc=2018", "conting": 0, "grad_n": 0, "date": "2017-09-05", "logica e matematica": null, "cultura generale": null, "cultura del progetto": null, "territorio e soc.": null, "user": null, "ragionamento logico": null, "storia": null, "disegno e rappresentazione": null, "matematica e fisica": null, "corso/i in lista di attesa": null, "comprensione del testo": null, "fisica e matematica": null, "conoscenze acquisite negli studi": null, "corso unico": null, "conoscenze tecniche": null, "supercorso": "INGEGNERIA"}, {"corso": "CHI1T1", "week": 0, "month": "09", "year": 2019, "first_scorr": 0, "last_scorr": 0, "people_n": 126, "min_tot": 48.81, "matr": "F309733", "Unnamed: 0": 83180, "af user": "F309733", "totale": 48.81, "matematica": "13.25", "comp.del testo": "2.50", "logica": "2.5", "fisica": "2.25", "corso di immatricolazione": null, "corso assegnato": null, "corso prenotato": "CHI1T1", "corsi in lista di attesa": "INGEGNERIA BIOMEDICA", "esito": "PRENOTATO", "uri": "http://didattica.polito.it/pls/portal30/preimma.pkg_grad.ing?p_data=04/09/2018&p_a_acc=2019", "conting": 0, "grad_n": 0, "date": "2018-09-04", "logica e matematica": null, "cultura generale": null, "cultura del progetto": null, "territorio e soc.": null, "user": null, "ragionamento logico": null, "storia": null, "disegno e rappresentazione": null, "matematica e fisica": null, "corso/i in lista di attesa": null, "comprensione del testo": null, "fisica e matematica": null, "conoscenze acquisite negli studi": null, "corso unico": null, "conoscenze tecniche": null, "supercorso": "INGEGNERIA"}, {"corso": "CHI1T1", "week": 0, "month": "09", "year": 2020, "first_scorr": 0, "last_scorr": 0, "people_n": 150, "min_tot": 45.24, "matr": "F323694", "Unnamed: 0": 207745, "af user": "F323694", "totale": 45.24, "matematica": "10.25", "comp.del testo": "3.50", "logica": "3.5", "fisica": "1.75", "corso di immatricolazione": null, "corso assegnato": null, "corso prenotato": "CHI1T1", "corsi in lista di attesa": "INGEGNERIA BIOMEDICA INGEGNERIA FISICA", "esito": "PRENOTATO", "uri": "http://didattica.polito.it/pls/portal30/preimma.pkg_grad.ing?p_data=03/09/2019&p_a_acc=2020", "conting": 0, "grad_n": 0, "date": "2019-09-03", "logica e matematica": null, "cultura generale": null, "cultura del progetto": null, "territorio e soc.": null, "user": null, "ragionamento logico": null, "storia": null, "disegno e rappresentazione": null, "matematica e fisica": null, "corso/i in lista di attesa": null, "comprensione del testo": null, "fisica e matematica": null, "conoscenze acquisite negli studi": null, "corso unico": null, "conoscenze tecniche": null, "supercorso": "INGEGNERIA"}, {"corso": "CHI1T1", "week": 0, "month": "09", "year": 2021, "first_scorr": 0, "last_scorr": 0, "people_n": 180, "min_tot": 44.05, "matr": "F393325", "Unnamed: 0": 303867, "af user": "F393325", "totale": 44.05, "matematica": "11.75", "comp.del testo": "6.00", "logica": "0.0", "fisica": "0.75", "corso di immatricolazione": null, "corso assegnato": "CHI1T1", "corso prenotato": null, "corsi in lista di attesa": null, "esito": "ASSEGNATO", "uri": "http://didattica.polito.it/pls/portal30/preimma.pkg_grad.ing?p_data=01/09/2020&p_a_acc=2021", "conting": 0, "grad_n": 0, "date": "2020-09-01", "logica e matematica": null, "cultura generale": null, "cultura del progetto": null, "territorio e soc.": null, "user": null, "ragionamento logico": null, "storia": null, "disegno e rappresentazione": null, "matematica e fisica": null, "corso/i in lista di attesa": null, "comprensione del testo": null, "fisica e matematica": null, "conoscenze acquisite negli studi": null, "corso unico": null, "conoscenze tecniche": null, "supercorso": "INGEGNERIA"}, {"corso": "CHI1T1", "week": 0, "month": "09", "year": 2022, "first_scorr": 0, "last_scorr": 0, "people_n": 176, "min_tot": 43.45, "matr": "F405655", "Unnamed: 0": 19705, "af user": "F405655", "totale": 43.45, "matematica": "10,75", "comp.del testo": "1,75", "logica": "1,75", "fisica": "4", "corso di immatricolazione": null, "corso assegnato": null, "corso prenotato": null, "corsi in lista di attesa": null, "esito": "ASSEGNATO", "uri": "http://didattica.polito.it/pls/portal30/preimma.pkg_grad.ing_sep?p_data=07/09/2021&p_a_acc=2022&p_mnemo=CHI1T1", "conting": 0, "grad_n": 0, "date": "2021-09-07", "logica e matematica": null, "cultura generale": null, "cultura del progetto": null, "territorio e soc.": null, "user": null, "ragionamento logico": null, "storia": null, "disegno e rappresentazione": null, "matematica e fisica": null, "corso/i in lista di attesa": null, "comprensione del testo": null, "fisica e matematica": null, "conoscenze acquisite negli studi": null, "corso unico": "CHI1T1", "conoscenze tecniche": null, "supercorso": "INGEGNERIA"}, {"corso": "CHI1T1", "week": 0, "month": "09", "year": 2023, "first_scorr": 0, "last_scorr": 0, "people_n": 211, "min_tot": 35.71, "matr": "F457098", "Unnamed: 0": 105608, "af user": "F457098", "totale": 35.71, "matematica": "8,25", "comp.del testo": "4,5", "logica": null, "fisica": "2,25", "corso di immatricolazione": null, "corso assegnato": null, "corso prenotato": null, "corsi in lista di attesa": null, "esito": "PRENOTATO", "uri": "http://didattica.polito.it/pls/portal30/preimma.pkg_grad.ing_sep?p_data=06/09/2022&p_a_acc=2023&p_mnemo=CHI1T1", "conting": 0, "grad_n": 0, "date": "2022-09-06", "logica e matematica": null, "cultura generale": null, "cultura del progetto": null, "territorio e soc.": null, "user": null, "ragionamento logico": null, "storia": null, "disegno e rappresentazione": null, "matematica e fisica": null, "corso/i in lista di attesa": null, "comprensione del testo": null, "fisica e matematica": null, "conoscenze acquisite negli studi": null, "corso unico": "CHI1T1", "conoscenze tecniche": "0", "supercorso": "INGEGNERIA"}, {"corso": "CHI1T1", "week": 0, "month": "09", "year": 2024, "first_scorr": 0, "last_scorr": 0, "people_n": 193, "min_tot": 38.1, "matr": "F506498", "Unnamed: 0": 200223, "af user": "F506498", "totale": 38.1, "matematica": "6,5", "comp.del testo": "5,25", "logica": null, "fisica": "2,75", "corso di immatricolazione": null, "corso assegnato": null, "corso prenotato": null, "corsi in lista di attesa": null, "esito": "PRENOTATO", "uri": "http://didattica.polito.it/pls/portal30/preimma.pkg_grad.ing_sep?p_data=05/09/2023&p_a_acc=2024&p_mnemo=CHI1T1", "conting": 0, "grad_n": 0, "date": "2023-09-05", "logica e matematica": null, "cultura generale": null, "cultura del progetto": null, "territorio e soc.": null, "user": null, "ragionamento logico": null, "storia": null, "disegno e rappresentazione": null, "matematica e fisica": null, "corso/i in lista di attesa": null, "comprensione del testo": null, "fisica e matematica": null, "conoscenze acquisite negli studi": null, "corso unico": "CHI1T1", "conoscenze tecniche": "1,5", "supercorso": "INGEGNERIA"}, {"corso": "CIN1T3", "week": 0, "month": "09", "year": 2018, "first_scorr": 0, "last_scorr": 0, "people_n": 113, "min_tot": 37.5, "matr": "F251964", "Unnamed: 0": 2794, "af user": "F251964", "totale": 37.5, "matematica": "8.75", "comp.del testo": "6.00", "logica": "-1.0", "fisica": "2.0", "corso di immatricolazione": null, "corso assegnato": null, "corso prenotato": "CIN1T3", "corsi in lista di attesa": "INGEGNERIA INFORMATICA INGEGNERIA GESTIONALE INGEGNERIA GESTIONALE", "esito": "PRENOTATO", "uri": "http://didattica.polito.it/pls/portal30/preimma.pkg_grad.ing?p_data=05/09/2017&p_a_acc=2018", "conting": 0, "grad_n": 0, "date": "2017-09-05", "logica e matematica": null, "cultura generale": null, "cultura del progetto": null, "territorio e soc.": null, "user": null, "ragionamento logico": null, "storia": null, "disegno e rappresentazione": null, "matematica e fisica": null, "corso/i in lista di attesa": null, "comprensione del testo": null, "fisica e matematica": null, "conoscenze acquisite negli studi": null, "corso unico": null, "conoscenze tecniche": null, "supercorso": "INGEGNERIA"}, {"corso": "CIN1T3", "week": 0, "month": "09", "year": 2019, "first_scorr": 0, "last_scorr": 0, "people_n": 111, "min_tot": 45.83, "matr": "F307426", "Unnamed: 0": 83701, "af user": "F307426", "totale": 45.83, "matematica": "9.25", "comp.del testo": "3.50", "logica": "3.75", "fisica": "2.75", "corso di immatricolazione": null, "corso assegnato": "CIN1T3", "corso prenotato": null, "corsi in lista di attesa": null, "esito": "ASSEGNATO", "uri": "http://didattica.polito.it/pls/portal30/preimma.pkg_grad.ing?p_data=04/09/2018&p_a_acc=2019", "conting": 0, "grad_n": 0, "date": "2018-09-04", "logica e matematica": null, "cultura generale": null, "cultura del progetto": null, "territorio e soc.": null, "user": null, "ragionamento logico": null, "storia": null, "disegno e rappresentazione": null, "matematica e fisica": null, "corso/i in lista di attesa": null, "comprensione del testo": null, "fisica e matematica": null, "conoscenze acquisite negli studi": null, "corso unico": null, "conoscenze tecniche": null, "supercorso": "INGEGNERIA"}, {"corso": "CIN1T3", "week": 0, "month": "09", "year": 2020, "first_scorr": 0, "last_scorr": 0, "people_n": 115, "min_tot": 45.24, "matr": "F325783", "Unnamed: 0": 207771, "af user": "F325783", "totale": 45.24, "matematica": "8.25", "comp.del testo": "3.50", "logica": "1.75", "fisica": "5.5", "corso di immatricolazione": null, "corso assegnato": "CIN1T3", "corso prenotato": null, "corsi in lista di attesa": null, "esito": "ASSEGNATO", "uri": "http://didattica.polito.it/pls/portal30/preimma.pkg_grad.ing?p_data=03/09/2019&p_a_acc=2020", "conting": 0, "grad_n": 0, "date": "2019-09-03", "logica e matematica": null, "cultura generale": null, "cultura del progetto": null, "territorio e soc.": null, "user": null, "ragionamento logico": null, "storia": null, "disegno e rappresentazione": null, "matematica e fisica": null, "corso/i in lista di attesa": null, "comprensione del testo": null, "fisica e matematica": null, "conoscenze acquisite negli studi": null, "corso unico": null, "conoscenze tecniche": null, "supercorso": "INGEGNERIA"}, {"corso": "CIN1T3", "week": 0, "month": "09", "year": 2021, "first_scorr": 0, "last_scorr": 0, "people_n": 134, "min_tot": 42.26, "matr": "F352231", "Unnamed: 0": 304108, "af user": "F352231", "totale": 42.26, "matematica": "10.75", "comp.del testo": "4.75", "logica": "2.5", "fisica": "-0.25", "corso di immatricolazione": null, "corso assegnato": null, "corso prenotato": "CIN1T3", "corsi in lista di attesa": "INGEGNERIA AEROSPAZIALE INGEGNERIA BIOMEDICA INGEGNERIA INFORMATICA", "esito": "PRENOTATO", "uri": "http://didattica.polito.it/pls/portal30/preimma.pkg_grad.ing?p_data=01/09/2020&p_a_acc=2021", "conting": 0, "grad_n": 0, "date": "2020-09-01", "logica e matematica": null, "cultura generale": null, "cultura del progetto": null, "territorio e soc.": null, "user": null, "ragionamento logico": null, "storia": null, "disegno e rappresentazione": null, "matematica e fisica": null, "corso/i in lista di attesa": null, "comprensione del testo": null, "fisica e matematica": null, "conoscenze acquisite negli studi": null, "corso unico": null, "conoscenze tecniche": null, "supercorso": "INGEGNERIA"}, {"corso": "CIN1T3", "week": 0, "month": "09", "year": 2022, "first_scorr": 0, "last_scorr": 0, "people_n": 126, "min_tot": 43.45, "matr": "F408702", "Unnamed: 0": 26290, "af user": "F408702", "totale": 43.45, "matematica": "9,75", "comp.del testo": "1,75", "logica": "2", "fisica": "4,75", "corso di immatricolazione": null, "corso assegnato": null, "corso prenotato": null, "corsi in lista di attesa": null, "esito": "ASSEGNATO", "uri": "http://didattica.polito.it/pls/portal30/preimma.pkg_grad.ing_sep?p_data=07/09/2021&p_a_acc=2022&p_mnemo=CIN1T3", "conting": 0, "grad_n": 0, "date": "2021-09-07", "logica e matematica": null, "cultura generale": null, "cultura del progetto": null, "territorio e soc.": null, "user": null, "ragionamento logico": null, "storia": null, "disegno e rappresentazione": null, "matematica e fisica": null, "corso/i in lista di attesa": null, "comprensione del testo": null, "fisica e matematica": null, "conoscenze acquisite negli studi": null, "corso unico": "CIN1T3", "conoscenze tecniche": null, "supercorso": "INGEGNERIA"}, {"corso": "CIN1T3", "week": 0, "month": "09", "year": 2023, "first_scorr": 0, "last_scorr": 0, "people_n": 157, "min_tot": 34.52, "matr": "F451672", "Unnamed: 0": 113844, "af user": "F451672", "totale": 34.52, "matematica": "9,25", "comp.del testo": "3", "logica": null, "fisica": "2", "corso di immatricolazione": null, "corso assegnato": null, "corso prenotato": null, "corsi in lista di attesa": null, "esito": "PRENOTATO", "uri": "http://didattica.polito.it/pls/portal30/preimma.pkg_grad.ing_sep?p_data=06/09/2022&p_a_acc=2023&p_mnemo=CIN1T3", "conting": 0, "grad_n": 0, "date": "2022-09-06", "logica e matematica": null, "cultura generale": null, "cultura del progetto": null, "territorio e soc.": null, "user": null, "ragionamento logico": null, "storia": null, "disegno e rappresentazione": null, "matematica e fisica": null, "corso/i in lista di attesa": null, "comprensione del testo": null, "fisica e matematica": null, "conoscenze acquisite negli studi": null, "corso unico": "CIN1T3", "conoscenze tecniche": "0,25", "supercorso": "INGEGNERIA"}, {"corso": "CIN1T3", "week": 0, "month": "09", "year": 2024, "first_scorr": 0, "last_scorr": 0, "people_n": 145, "min_tot": 38.69, "matr": "F470211", "Unnamed: 0": 207345, "af user": "F470211", "totale": 38.69, "matematica": "5,5", "comp.del testo": "7,5", "logica": null, "fisica": "2", "corso di immatricolazione": null, "corso assegnato": null, "corso prenotato": null, "corsi in lista di attesa": null, "esito": "ASSEGNATO", "uri": "http://didattica.polito.it/pls/portal30/preimma.pkg_grad.ing_sep?p_data=05/09/2023&p_a_acc=2024&p_mnemo=CIN1T3", "conting": 0, "grad_n": 0, "date": "2023-09-05", "logica e matematica": null, "cultura generale": null, "cultura del progetto": null, "territorio e soc.": null, "user": null, "ragionamento logico": null, "storia": null, "disegno e rappresentazione": null, "matematica e fisica": null, "corso/i in lista di attesa": null, "comprensione del testo": null, "fisica e matematica": null, "conoscenze acquisite negli studi": null, "corso unico": "CIN1T3", "conoscenze tecniche": "1,25", "supercorso": "INGEGNERIA"}, {"corso": "CIV1T1", "week": 0, "month": "09", "year": 2018, "first_scorr": 0, "last_scorr": 0, "people_n": 134, "min_tot": 32.74, "matr": "F257430", "Unnamed: 0": 3311, "af user": "F257430", "totale": 32.74, "matematica": "8.5", "comp.del testo": "3.50", "logica": "2.25", "fisica": "-0.5", "corso di immatricolazione": null, "corso assegnato": null, "corso prenotato": "CIV1T1", "corsi in lista di attesa": "INGEGNERIA DEL CINEMA E DEI MEZZI DI COMUNICAZIONE INGEGNERIA AEROSPAZIALE INGEGNERIA INFORMATICA", "esito": "PRENOTATO", "uri": "http://didattica.polito.it/pls/portal30/preimma.pkg_grad.ing?p_data=05/09/2017&p_a_acc=2018", "conting": 0, "grad_n": 0, "date": "2017-09-05", "logica e matematica": null, "cultura generale": null, "cultura del progetto": null, "territorio e soc.": null, "user": null, "ragionamento logico": null, "storia": null, "disegno e rappresentazione": null, "matematica e fisica": null, "corso/i in lista di attesa": null, "comprensione del testo": null, "fisica e matematica": null, "conoscenze acquisite negli studi": null, "corso unico": null, "conoscenze tecniche": null, "supercorso": "INGEGNERIA"}, {"corso": "CIV1T1", "week": 0, "month": "09", "year": 2019, "first_scorr": 0, "last_scorr": 0, "people_n": 132, "min_tot": 42.86, "matr": "F307492", "Unnamed: 0": 84155, "af user": "F307492", "totale": 42.86, "matematica": "11.25", "comp.del testo": "6.00", "logica": "0.25", "fisica": "0.5", "corso di immatricolazione": null, "corso assegnato": null, "corso prenotato": "CIV1T1", "corsi in lista di attesa": "INGEGNERIA MECCANICA INGEGNERIA DEL CINEMA E DEI MEZZI DI COMUNICAZIONE INGEGNERIA AEROSPAZIALE INGEGNERIA DEI MATERIALI INGEGNERIA DELLA PRODUZIONE INDUSTRIALE (Athlone)", "esito": "PRENOTATO", "uri": "http://didattica.polito.it/pls/portal30/preimma.pkg_grad.ing?p_data=04/09/2018&p_a_acc=2019", "conting": 0, "grad_n": 0, "date": "2018-09-04", "logica e matematica": null, "cultura generale": null, "cultura del progetto": null, "territorio e soc.": null, "user": null, "ragionamento logico": null, "storia": null, "disegno e rappresentazione": null, "matematica e fisica": null, "corso/i in lista di attesa": null, "comprensione del testo": null, "fisica e matematica": null, "conoscenze acquisite negli studi": null, "corso unico": null, "conoscenze tecniche": null, "supercorso": "INGEGNERIA"}, {"corso": "CIV1T1", "week": 0, "month": "09", "year": 2020, "first_scorr": 0, "last_scorr": 0, "people_n": 64, "min_tot": 45.24, "matr": "F323404", "Unnamed: 0": 207764, "af user": "F323404", "totale": 45.24, "matematica": "8.5", "comp.del testo": "3.50", "logica": "2.25", "fisica": "4.75", "corso di immatricolazione": null, "corso assegnato": "CIV1T1", "corso prenotato": null, "corsi in lista di attesa": null, "esito": "ASSEGNATO", "uri": "http://didattica.polito.it/pls/portal30/preimma.pkg_grad.ing?p_data=03/09/2019&p_a_acc=2020", "conting": 0, "grad_n": 0, "date": "2019-09-03", "logica e matematica": null, "cultura generale": null, "cultura del progetto": null, "territorio e soc.": null, "user": null, "ragionamento logico": null, "storia": null, "disegno e rappresentazione": null, "matematica e fisica": null, "corso/i in lista di attesa": null, "comprensione del testo": null, "fisica e matematica": null, "conoscenze acquisite negli studi": null, "corso unico": null, "conoscenze tecniche": null, "supercorso": "INGEGNERIA"}, {"corso": "CIV1T1", "week": 0, "month": "09", "year": 2021, "first_scorr": 0, "last_scorr": 0, "people_n": 153, "min_tot": 40.48, "matr": "F370722", "Unnamed: 0": 304336, "af user": "F370722", "totale": 40.48, "matematica": "9.75", "comp.del testo": "4.75", "logica": "2.25", "fisica": "0.25", "corso di immatricolazione": null, "corso assegnato": null, "corso prenotato": "CIV1T1", "corsi in lista di attesa": "INGEGNERIA INFORMATICA", "esito": "PRENOTATO", "uri": "http://didattica.polito.it/pls/portal30/preimma.pkg_grad.ing?p_data=01/09/2020&p_a_acc=2021", "conting": 0, "grad_n": 0, "date": "2020-09-01", "logica e matematica": null, "cultura generale": null, "cultura del progetto": null, "territorio e soc.": null, "user": null, "ragionamento logico": null, "storia": null, "disegno e rappresentazione": null, "matematica e fisica": null, "corso/i in lista di attesa": null, "comprensione del testo": null, "fisica e matematica": null, "conoscenze acquisite negli studi": null, "corso unico": null, "conoscenze tecniche": null, "supercorso": "INGEGNERIA"}, {"corso": "CIV1T1", "week": 0, "month": "09", "year": 2022, "first_scorr": 0, "last_scorr": 0, "people_n": 140, "min_tot": 39.29, "matr": "F441115", "Unnamed: 0": 22572, "af user": "F441115", "totale": 39.29, "matematica": "8,75", "comp.del testo": "3,75", "logica": "2,25", "fisica": "1,75", "corso di immatricolazione": null, "corso assegnato": null, "corso prenotato": null, "corsi in lista di attesa": null, "esito": "PRENOTATO", "uri": "http://didattica.polito.it/pls/portal30/preimma.pkg_grad.ing_sep?p_data=07/09/2021&p_a_acc=2022&p_mnemo=CIV1T1", "conting": 0, "grad_n": 0, "date": "2021-09-07", "logica e matematica": null, "cultura generale": null, "cultura del progetto": null, "territorio e soc.": null, "user": null, "ragionamento logico": null, "storia": null, "disegno e rappresentazione": null, "matematica e fisica": null, "corso/i in lista di attesa": null, "comprensione del testo": null, "fisica e matematica": null, "conoscenze acquisite negli studi": null, "corso unico": "CIV1T1", "conoscenze tecniche": null, "supercorso": "INGEGNERIA"}, {"corso": "CIV1T1", "week": 0, "month": "09", "year": 2023, "first_scorr": 0, "last_scorr": 0, "people_n": 176, "min_tot": 29.17, "matr": "F451385", "Unnamed: 0": 109092, "af user": "F451385", "totale": 29.17, "matematica": "6,75", "comp.del testo": "2,5", "logica": null, "fisica": "1,5", "corso di immatricolazione": null, "corso assegnato": null, "corso prenotato": null, "corsi in lista di attesa": null, "esito": "ASSEGNATO", "uri": "http://didattica.polito.it/pls/portal30/preimma.pkg_grad.ing_sep?p_data=06/09/2022&p_a_acc=2023&p_mnemo=CIV1T1", "conting": 0, "grad_n": 0, "date": "2022-09-06", "logica e matematica": null, "cultura generale": null, "cultura del progetto": null, "territorio e soc.": null, "user": null, "ragionamento logico": null, "storia": null, "disegno e rappresentazione": null, "matematica e fisica": null, "corso/i in lista di attesa": null, "comprensione del testo": null, "fisica e matematica": null, "conoscenze acquisite negli studi": null, "corso unico": "CIV1T1", "conoscenze tecniche": "1,5", "supercorso": "INGEGNERIA"}, {"corso": "CIV1T1", "week": 0, "month": "09", "year": 2024, "first_scorr": 0, "last_scorr": 0, "people_n": 161, "min_tot": 37.5, "matr": "F537306", "Unnamed: 0": 202821, "af user": "F537306", "totale": 37.5, "matematica": "7,5", "comp.del testo": "6,25", "logica": null, "fisica": "-0,75", "corso di immatricolazione": null, "corso assegnato": null, "corso prenotato": null, "corsi in lista di attesa": null, "esito": "ASSEGNATO", "uri": "http://didattica.polito.it/pls/portal30/preimma.pkg_grad.ing_sep?p_data=05/09/2023&p_a_acc=2024&p_mnemo=CIV1T1", "conting": 0, "grad_n": 0, "date": "2023-09-05", "logica e matematica": null, "cultura generale": null, "cultura del progetto": null, "territorio e soc.": null, "user": null, "ragionamento logico": null, "storia": null, "disegno e rappresentazione": null, "matematica e fisica": null, "corso/i in lista di attesa": null, "comprensione del testo": null, "fisica e matematica": null, "conoscenze acquisite negli studi": null, "corso unico": "CIV1T1", "conoscenze tecniche": "2,75", "supercorso": "INGEGNERIA"}, {"corso": "DESIGN", "week": 0, "month": "09", "year": 2018, "first_scorr": 0, "last_scorr": 0, "people_n": 125, "min_tot": 54.17, "matr": "F262529", "Unnamed: 0": 71645, "af user": "F262529", "totale": 54.17, "matematica": null, "comp.del testo": "3,75/6", "logica": null, "fisica": null, "corso di immatricolazione": null, "corso assegnato": null, "corso prenotato": null, "corsi in lista di attesa": null, "esito": "ASSEGNATO", "uri": "http://didattica.polito.it/pls/portal30/preimma.pkg_grad.des?p_data=05/09/2017&p_a_acc=2018", "conting": 0, "grad_n": 0, "date": "2017-09-05", "logica e matematica": "8,75/12", "cultura generale": "5,25/12", "cultura del progetto": "5,00/12", "territorio e soc.": null, "user": null, "ragionamento logico": null, "storia": null, "disegno e rappresentazione": null, "matematica e fisica": null, "corso/i in lista di attesa": null, "comprensione del testo": null, "fisica e matematica": null, "conoscenze acquisite negli studi": null, "corso unico": null, "conoscenze tecniche": null, "supercorso": "DESIGN"}, {"corso": "DESIGN", "week": 0, "month": "09", "year": 2019, "first_scorr": 0, "last_scorr": 0, "people_n": 246, "min_tot": 57.74, "matr": "F307877", "Unnamed: 0": 193143, "af user": "F307877", "totale": 57.74, "matematica": null, "comp.del testo": "2,75/6", "logica": null, "fisica": null, "corso di immatricolazione": null, "corso assegnato": null, "corso prenotato": null, "corsi in lista di attesa": null, "esito": "ASSEGNATO", "uri": "http://didattica.polito.it/pls/portal30/preimma.pkg_grad.des?p_data=04/09/2018&p_a_acc=2019", "conting": 0, "grad_n": 0, "date": "2018-09-04", "logica e matematica": "5,75/12", "cultura generale": "6,00/12", "cultura del progetto": "9,75/12", "territorio e soc.": null, "user": null, "ragionamento logico": null, "storia": null, "disegno e rappresentazione": null, "matematica e fisica": null, "corso/i in lista di attesa": null, "comprensione del testo": null, "fisica e matematica": null, "conoscenze acquisite negli studi": null, "corso unico": null, "conoscenze tecniche": null, "supercorso": "DESIGN"}, {"corso": "DESIGN", "week": 0, "month": "09", "year": 2020, "first_scorr": 0, "last_scorr": 0, "people_n": 247, "min_tot": 55.95, "matr": "F335644", "Unnamed: 0": 286092, "af user": "F335644", "totale": 55.95, "matematica": null, "comp.del testo": "3,75/6", "logica": null, "fisica": null, "corso di immatricolazione": null, "corso assegnato": null, "corso prenotato": null, "corsi in lista di attesa": null, "esito": "ASSEGNATO", "uri": "http://didattica.polito.it/pls/portal30/preimma.pkg_grad.des?p_data=03/09/2019&p_a_acc=2020", "conting": 0, "grad_n": 0, "date": "2019-09-03", "logica e matematica": "2,75/12", "cultura generale": "6,25/12", "cultura del progetto": "10,75/12", "territorio e soc.": null, "user": null, "ragionamento logico": null, "storia": null, "disegno e rappresentazione": null, "matematica e fisica": null, "corso/i in lista di attesa": null, "comprensione del testo": null, "fisica e matematica": null, "conoscenze acquisite negli studi": null, "corso unico": null, "conoscenze tecniche": null, "supercorso": "DESIGN"}, {"corso": "DESIGN", "week": 0, "month": "09", "year": 2021, "first_scorr": 0, "last_scorr": 0, "people_n": 321, "min_tot": 60.12, "matr": "F362330", "Unnamed: 0": 409948, "af user": "F362330", "totale": 60.12, "matematica": null, "comp.del testo": "4,75/6", "logica": null, "fisica": null, "corso di immatricolazione": null, "corso assegnato": null, "corso prenotato": null, "corsi in lista di attesa": null, "esito": "IMMATRICOLATO", "uri": "http://didattica.polito.it/pls/portal30/preimma.pkg_grad.des?p_data=01/09/2020&p_a_acc=2021", "conting": 0, "grad_n": 0, "date": "2020-09-01", "logica e matematica": "1,25/12", "cultura generale": "8,25/12", "cultura del progetto": "11,00/12", "territorio e soc.": null, "user": null, "ragionamento logico": null, "storia": null, "disegno e rappresentazione": null, "matematica e fisica": null, "corso/i in lista di attesa": null, "comprensione del testo": null, "fisica e matematica": null, "conoscenze acquisite negli studi": null, "corso unico": null, "conoscenze tecniche": null, "supercorso": "DESIGN"}, {"corso": "DESIGN", "week": 0, "month": "09", "year": 2022, "first_scorr": 0, "last_scorr": 0, "people_n": 443, "min_tot": 60.12, "matr": "F429721", "Unnamed: 0": 424946, "af user": "F429721", "totale": 60.12, "matematica": null, "comp.del testo": "4,75/6", "logica": null, "fisica": null, "corso di immatricolazione": null, "corso assegnato": null, "corso prenotato": null, "corsi in lista di attesa": null, "esito": "IMMATRICOLATO", "uri": "http://didattica.polito.it/pls/portal30/preimma.pkg_grad.des?p_data=07/09/2021&p_a_acc=2022", "conting": 0, "grad_n": 0, "date": "2021-09-07", "logica e matematica": "6,00/12", "cultura generale": "3,75/12", "cultura del progetto": "10,75/12", "territorio e soc.": null, "user": null, "ragionamento logico": null, "storia": null, "disegno e rappresentazione": null, "matematica e fisica": null, "corso/i in lista di attesa": null, "comprensione del testo": null, "fisica e matematica": null, "conoscenze acquisite negli studi": null, "corso unico": null, "conoscenze tecniche": null, "supercorso": "DESIGN"}, {"corso": "DESIGN", "week": 0, "month": "09", "year": 2023, "first_scorr": 0, "last_scorr": 0, "people_n": 282, "min_tot": 56.55, "matr": "F483921", "Unnamed: 0": 447931, "af user": "F483921", "totale": 56.55, "matematica": null, "comp.del testo": "5,00/6", "logica": null, "fisica": null, "corso di immatricolazione": null, "corso assegnato": null, "corso prenotato": null, "corsi in lista di attesa": null, "esito": "ASSEGNATO", "uri": "http://didattica.polito.it/pls/portal30/preimma.pkg_grad.des?p_data=06/09/2022&p_a_acc=2023", "conting": 0, "grad_n": 0, "date": "2022-09-06", "logica e matematica": "4,75/12", "cultura generale": "4,25/12", "cultura del progetto": "9,75/12", "territorio e soc.": null, "user": null, "ragionamento logico": null, "storia": null, "disegno e rappresentazione": null, "matematica e fisica": null, "corso/i in lista di attesa": null, "comprensione del testo": null, "fisica e matematica": null, "conoscenze acquisite negli studi": null, "corso unico": null, "conoscenze tecniche": null, "supercorso": "DESIGN"}, {"corso": "DESIGN", "week": 0, "month": "09", "year": 2024, "first_scorr": 0, "last_scorr": 0, "people_n": 253, "min_tot": 61.31, "matr": "F518949", "Unnamed: 0": 470460, "af user": "F518949", "totale": 61.31, "matematica": null, "comp.del testo": "6,00/6", "logica": null, "fisica": null, "corso di immatricolazione": null, "corso assegnato": null, "corso prenotato": null, "corsi in lista di attesa": null, "esito": "ASSEGNATO", "uri": "http://didattica.polito.it/pls/portal30/preimma.pkg_grad.des?p_data=05/09/2023&p_a_acc=2024", "conting": 0, "grad_n": 0, "date": "2023-09-05", "logica e matematica": "7,50/12", "cultura generale": "2,50/12", "cultura del progetto": "9,75/12", "territorio e soc.": null, "user": null, "ragionamento logico": null, "storia": null, "disegno e rappresentazione": null, "matematica e fisica": null, "corso/i in lista di attesa": null, "comprensione del testo": null, "fisica e matematica": null, "conoscenze acquisite negli studi": null, "corso unico": null, "conoscenze tecniche": null, "supercorso": "DESIGN"}, {"corso": "ECE1T3", "week": 0, "month": "09", "year": 2018, "first_scorr": 0, "last_scorr": 0, "people_n": 37, "min_tot": 33.93, "matr": "F258434", "Unnamed: 0": 3207, "af user": "F258434", "totale": 33.93, "matematica": "6.5", "comp.del testo": "6.00", "logica": "1.25", "fisica": "0.5", "corso di immatricolazione": null, "corso assegnato": null, "corso prenotato": "ECE1T3", "corsi in lista di attesa": "INGEGNERIA MECCANICA INGEGNERIA AEROSPAZIALE", "esito": "PRENOTATO", "uri": "http://didattica.polito.it/pls/portal30/preimma.pkg_grad.ing?p_data=05/09/2017&p_a_acc=2018", "conting": 0, "grad_n": 0, "date": "2017-09-05", "logica e matematica": null, "cultura generale": null, "cultura del progetto": null, "territorio e soc.": null, "user": null, "ragionamento logico": null, "storia": null, "disegno e rappresentazione": null, "matematica e fisica": null, "corso/i in lista di attesa": null, "comprensione del testo": null, "fisica e matematica": null, "conoscenze acquisite negli studi": null, "corso unico": null, "conoscenze tecniche": null, "supercorso": "INGEGNERIA"}, {"corso": "ECE1T3", "week": 0, "month": "09", "year": 2019, "first_scorr": 0, "last_scorr": 0, "people_n": 36, "min_tot": 44.64, "matr": "F287687", "Unnamed: 0": 83891, "af user": "F287687", "totale": 44.64, "matematica": "9.75", "comp.del testo": "4.75", "logica": "2.75", "fisica": "1.5", "corso di immatricolazione": null, "corso assegnato": null, "corso prenotato": "ECE1T3", "corsi in lista di attesa": "INGEGNERIA DELLA PRODUZIONE INDUSTRIALE (Athlone)", "esito": "PRENOTATO", "uri": "http://didattica.polito.it/pls/portal30/preimma.pkg_grad.ing?p_data=04/09/2018&p_a_acc=2019", "conting": 0, "grad_n": 0, "date": "2018-09-04", "logica e matematica": null, "cultura generale": null, "cultura del progetto": null, "territorio e soc.": null, "user": null, "ragionamento logico": null, "storia": null, "disegno e rappresentazione": null, "matematica e fisica": null, "corso/i in lista di attesa": null, "comprensione del testo": null, "fisica e matematica": null, "conoscenze acquisite negli studi": null, "corso unico": null, "conoscenze tecniche": null, "supercorso": "INGEGNERIA"}, {"corso": "ECE1T3", "week": 0, "month": "09", "year": 2020, "first_scorr": 0, "last_scorr": 0, "people_n": 39, "min_tot": 45.24, "matr": "F326560", "Unnamed: 0": 207783, "af user": "F326560", "totale": 45.24, "matematica": "7.5", "comp.del testo": "6.00", "logica": "2.5", "fisica": "3.0", "corso di immatricolazione": null, "corso assegnato": null, "corso prenotato": "ECE1T3", "corsi in lista di attesa": "INGEGNERIA INFORMATICA", "esito": "PRENOTATO", "uri": "http://didattica.polito.it/pls/portal30/preimma.pkg_grad.ing?p_data=03/09/2019&p_a_acc=2020", "conting": 0, "grad_n": 0, "date": "2019-09-03", "logica e matematica": null, "cultura generale": null, "cultura del progetto": null, "territorio e soc.": null, "user": null, "ragionamento logico": null, "storia": null, "disegno e rappresentazione": null, "matematica e fisica": null, "corso/i in lista di attesa": null, "comprensione del testo": null, "fisica e matematica": null, "conoscenze acquisite negli studi": null, "corso unico": null, "conoscenze tecniche": null, "supercorso": "INGEGNERIA"}, {"corso": "ECE1T3", "week": 0, "month": "09", "year": 2021, "first_scorr": 0, "last_scorr": 0, "people_n": 63, "min_tot": 42.26, "matr": "F365921", "Unnamed: 0": 304105, "af user": "F365921", "totale": 42.26, "matematica": "12.25", "comp.del testo": "2.25", "logica": "4.75", "fisica": "-1.5", "corso di immatricolazione": null, "corso assegnato": null, "corso prenotato": "ECE1T3", "corsi in lista di attesa": "INGEGNERIA INFORMATICA INGEGNERIA DELL'AUTOVEICOLO INGEGNERIA AEROSPAZIALE INGEGNERIA ELETTRONICA", "esito": "PRENOTATO", "uri": "http://didattica.polito.it/pls/portal30/preimma.pkg_grad.ing?p_data=01/09/2020&p_a_acc=2021", "conting": 0, "grad_n": 0, "date": "2020-09-01", "logica e matematica": null, "cultura generale": null, "cultura del progetto": null, "territorio e soc.": null, "user": null, "ragionamento logico": null, "storia": null, "disegno e rappresentazione": null, "matematica e fisica": null, "corso/i in lista di attesa": null, "comprensione del testo": null, "fisica e matematica": null, "conoscenze acquisite negli studi": null, "corso unico": null, "conoscenze tecniche": null, "supercorso": "INGEGNERIA"}, {"corso": "ECE1T3", "week": 0, "month": "09", "year": 2022, "first_scorr": 0, "last_scorr": 0, "people_n": 64, "min_tot": 32.74, "matr": "F418216", "Unnamed: 0": 62, "af user": "F418216", "totale": 32.74, "matematica": "3,75", "comp.del testo": "1,5", "logica": "-0,25", "fisica": "8,75", "corso di immatricolazione": null, "corso assegnato": null, "corso prenotato": null, "corsi in lista di attesa": null, "esito": "PRENOTATO", "uri": "http://didattica.polito.it/pls/portal30/preimma.pkg_grad.ing_sep?p_data=07/09/2021&p_a_acc=2022&p_mnemo=ECE1T3", "conting": 0, "grad_n": 0, "date": "2021-09-07", "logica e matematica": null, "cultura generale": null, "cultura del progetto": null, "territorio e soc.": null, "user": null, "ragionamento logico": null, "storia": null, "disegno e rappresentazione": null, "matematica e fisica": null, "corso/i in lista di attesa": null, "comprensione del testo": null, "fisica e matematica": null, "conoscenze acquisite negli studi": null, "corso unico": "ECE1T3", "conoscenze tecniche": null, "supercorso": "INGEGNERIA"}, {"corso": "ECE1T3", "week": 0, "month": "09", "year": 2023, "first_scorr": 0, "last_scorr": 0, "people_n": 64, "min_tot": 34.52, "matr": "F466952", "Unnamed: 0": 86940, "af user": "F466952", "totale": 34.52, "matematica": "5,75", "comp.del testo": "4", "logica": null, "fisica": "2,25", "corso di immatricolazione": null, "corso assegnato": null, "corso prenotato": null, "corsi in lista di attesa": null, "esito": "PRENOTATO", "uri": "http://didattica.polito.it/pls/portal30/preimma.pkg_grad.ing_sep?p_data=06/09/2022&p_a_acc=2023&p_mnemo=ECE1T3", "conting": 0, "grad_n": 0, "date": "2022-09-06", "logica e matematica": null, "cultura generale": null, "cultura del progetto": null, "territorio e soc.": null, "user": null, "ragionamento logico": null, "storia": null, "disegno e rappresentazione": null, "matematica e fisica": null, "corso/i in lista di attesa": null, "comprensione del testo": null, "fisica e matematica": null, "conoscenze acquisite negli studi": null, "corso unico": "ECE1T3", "conoscenze tecniche": "2,5", "supercorso": "INGEGNERIA"}, {"corso": "ECE1T3", "week": 0, "month": "09", "year": 2024, "first_scorr": 0, "last_scorr": 0, "people_n": 50, "min_tot": 37.5, "matr": "F539847", "Unnamed: 0": 183897, "af user": "F539847", "totale": 37.5, "matematica": "4,25", "comp.del testo": "7,5", "logica": null, "fisica": "0,25", "corso di immatricolazione": null, "corso assegnato": null, "corso prenotato": null, "corsi in lista di attesa": null, "esito": "PRENOTATO", "uri": "http://didattica.polito.it/pls/portal30/preimma.pkg_grad.ing_sep?p_data=05/09/2023&p_a_acc=2024&p_mnemo=ECE1T3", "conting": 0, "grad_n": 0, "date": "2023-09-05", "logica e matematica": null, "cultura generale": null, "cultura del progetto": null, "territorio e soc.": null, "user": null, "ragionamento logico": null, "storia": null, "disegno e rappresentazione": null, "matematica e fisica": null, "corso/i in lista di attesa": null, "comprensione del testo": null, "fisica e matematica": null, "conoscenze acquisite negli studi": null, "corso unico": "ECE1T3", "conoscenze tecniche": "3,75", "supercorso": "INGEGNERIA"}, {"corso": "EDI1T1", "week": 0, "month": "09", "year": 2018, "first_scorr": 0, "last_scorr": 0, "people_n": 114, "min_tot": 33.33, "matr": "F263825", "Unnamed: 0": 3263, "af user": "F263825", "totale": 33.33, "matematica": "7.5", "comp.del testo": "1.50", "logica": "1.25", "fisica": "3.75", "corso di immatricolazione": null, "corso assegnato": null, "corso prenotato": "EDI1T1", "corsi in lista di attesa": "INGEGNERIA MECCANICA INGEGNERIA ENERGETICA INGEGNERIA ELETTRONICA INGEGNERIA BIOMEDICA", "esito": "PRENOTATO", "uri": "http://didattica.polito.it/pls/portal30/preimma.pkg_grad.ing?p_data=05/09/2017&p_a_acc=2018", "conting": 0, "grad_n": 0, "date": "2017-09-05", "logica e matematica": null, "cultura generale": null, "cultura del progetto": null, "territorio e soc.": null, "user": null, "ragionamento logico": null, "storia": null, "disegno e rappresentazione": null, "matematica e fisica": null, "corso/i in lista di attesa": null, "comprensione del testo": null, "fisica e matematica": null, "conoscenze acquisite negli studi": null, "corso unico": null, "conoscenze tecniche": null, "supercorso": "INGEGNERIA"}, {"corso": "EDI1T1", "week": 0, "month": "09", "year": 2019, "first_scorr": 0, "last_scorr": 0, "people_n": 111, "min_tot": 42.26, "matr": "F290265", "Unnamed: 0": 84251, "af user": "F290265", "totale": 42.26, "matematica": "12.0", "comp.del testo": "1.00", "logica": "3.5", "fisica": "1.25", "corso di immatricolazione": null, "corso assegnato": "EDI1T1", "corso prenotato": null, "corsi in lista di attesa": null, "esito": "ASSEGNATO", "uri": "http://didattica.polito.it/pls/portal30/preimma.pkg_grad.ing?p_data=04/09/2018&p_a_acc=2019", "conting": 0, "grad_n": 0, "date": "2018-09-04", "logica e matematica": null, "cultura generale": null, "cultura del progetto": null, "territorio e soc.": null, "user": null, "ragionamento logico": null, "storia": null, "disegno e rappresentazione": null, "matematica e fisica": null, "corso/i in lista di attesa": null, "comprensione del testo": null, "fisica e matematica": null, "conoscenze acquisite negli studi": null, "corso unico": null, "conoscenze tecniche": null, "supercorso": "INGEGNERIA"}, {"corso": "EDI1T1", "week": 0, "month": "09", "year": 2020, "first_scorr": 0, "last_scorr": 0, "people_n": 38, "min_tot": 45.24, "matr": "F325644", "Unnamed: 0": 207752, "af user": "F325644", "totale": 45.24, "matematica": "9.25", "comp.del testo": "4.75", "logica": "2.25", "fisica": "2.75", "corso di immatricolazione": null, "corso assegnato": "EDI1T1", "corso prenotato": null, "corsi in lista di attesa": null, "esito": "ASSEGNATO", "uri": "http://didattica.polito.it/pls/portal30/preimma.pkg_grad.ing?p_data=03/09/2019&p_a_acc=2020", "conting": 0, "grad_n": 0, "date": "2019-09-03", "logica e matematica": null, "cultura generale": null, "cultura del progetto": null, "territorio e soc.": null, "user": null, "ragionamento logico": null, "storia": null, "disegno e rappresentazione": null, "matematica e fisica": null, "corso/i in lista di attesa": null, "comprensione del testo": null, "fisica e matematica": null, "conoscenze acquisite negli studi": null, "corso unico": null, "conoscenze tecniche": null, "supercorso": "INGEGNERIA"}, {"corso": "EDI1T1", "week": 0, "month": "09", "year": 2021, "first_scorr": 0, "last_scorr": 0, "people_n": 108, "min_tot": 40.48, "matr": "F391955", "Unnamed: 0": 304335, "af user": "F391955", "totale": 40.48, "matematica": "10.5", "comp.del testo": "2.25", "logica": "2.5", "fisica": "1.75", "corso di immatricolazione": null, "corso assegnato": null, "corso prenotato": "EDI1T1", "corsi in lista di attesa": "INGEGNERIA BIOMEDICA INGEGNERIA CHIMICA E ALIMENTARE INGEGNERIA GESTIONALE", "esito": "PRENOTATO", "uri": "http://didattica.polito.it/pls/portal30/preimma.pkg_grad.ing?p_data=01/09/2020&p_a_acc=2021", "conting": 0, "grad_n": 0, "date": "2020-09-01", "logica e matematica": null, "cultura generale": null, "cultura del progetto": null, "territorio e soc.": null, "user": null, "ragionamento logico": null, "storia": null, "disegno e rappresentazione": null, "matematica e fisica": null, "corso/i in lista di attesa": null, "comprensione del testo": null, "fisica e matematica": null, "conoscenze acquisite negli studi": null, "corso unico": null, "conoscenze tecniche": null, "supercorso": "INGEGNERIA"}, {"corso": "EDI1T1", "week": 0, "month": "09", "year": 2022, "first_scorr": 0, "last_scorr": 0, "people_n": 100, "min_tot": 39.88, "matr": "F415396", "Unnamed: 0": 33969, "af user": "F415396", "totale": 39.88, "matematica": "9", "comp.del testo": "3,5", "logica": "1,5", "fisica": "2,75", "corso di immatricolazione": null, "corso assegnato": null, "corso prenotato": null, "corsi in lista di attesa": null, "esito": "PRENOTATO", "uri": "http://didattica.polito.it/pls/portal30/preimma.pkg_grad.ing_sep?p_data=07/09/2021&p_a_acc=2022&p_mnemo=EDI1T1", "conting": 0, "grad_n": 0, "date": "2021-09-07", "logica e matematica": null, "cultura generale": null, "cultura del progetto": null, "territorio e soc.": null, "user": null, "ragionamento logico": null, "storia": null, "disegno e rappresentazione": null, "matematica e fisica": null, "corso/i in lista di attesa": null, "comprensione del testo": null, "fisica e matematica": null, "conoscenze acquisite negli studi": null, "corso unico": "EDI1T1", "conoscenze tecniche": null, "supercorso": "INGEGNERIA"}, {"corso": "EDI1T1", "week": 0, "month": "09", "year": 2023, "first_scorr": 0, "last_scorr": 0, "people_n": 126, "min_tot": 30.95, "matr": "F450248", "Unnamed: 0": 123916, "af user": "F450248", "totale": 30.95, "matematica": "5,25", "comp.del testo": "3,75", "logica": null, "fisica": "1", "corso di immatricolazione": null, "corso assegnato": null, "corso prenotato": null, "corsi in lista di attesa": null, "esito": "PRENOTATO", "uri": "http://didattica.polito.it/pls/portal30/preimma.pkg_grad.ing_sep?p_data=06/09/2022&p_a_acc=2023&p_mnemo=EDI1T1", "conting": 0, "grad_n": 0, "date": "2022-09-06", "logica e matematica": null, "cultura generale": null, "cultura del progetto": null, "territorio e soc.": null, "user": null, "ragionamento logico": null, "storia": null, "disegno e rappresentazione": null, "matematica e fisica": null, "corso/i in lista di attesa": null, "comprensione del testo": null, "fisica e matematica": null, "conoscenze acquisite negli studi": null, "corso unico": "EDI1T1", "conoscenze tecniche": "3", "supercorso": "INGEGNERIA"}, {"corso": "EDI1T1", "week": 0, "month": "09", "year": 2024, "first_scorr": 0, "last_scorr": 0, "people_n": 116, "min_tot": 39.29, "matr": "F496951", "Unnamed: 0": 216932, "af user": "F496951", "totale": 39.29, "matematica": "8,5", "comp.del testo": "7,5", "logica": null, "fisica": "0", "corso di immatricolazione": null, "corso assegnato": null, "corso prenotato": null, "corsi in lista di attesa": null, "esito": "ASSEGNATO", "uri": "http://didattica.polito.it/pls/portal30/preimma.pkg_grad.ing_sep?p_data=05/09/2023&p_a_acc=2024&p_mnemo=EDI1T1", "conting": 0, "grad_n": 0, "date": "2023-09-05", "logica e matematica": null, "cultura generale": null, "cultura del progetto": null, "territorio e soc.": null, "user": null, "ragionamento logico": null, "storia": null, "disegno e rappresentazione": null, "matematica e fisica": null, "corso/i in lista di attesa": null, "comprensione del testo": null, "fisica e matematica": null, "conoscenze acquisite negli studi": null, "corso unico": "EDI1T1", "conoscenze tecniche": "0,5", "supercorso": "INGEGNERIA"}, {"corso": "ELN1T3", "week": 0, "month": "09", "year": 2018, "first_scorr": 0, "last_scorr": 0, "people_n": 119, "min_tot": 43.45, "matr": "F261432", "Unnamed: 0": 1988, "af user": "F261432", "totale": 43.45, "matematica": "9.25", "comp.del testo": "2.50", "logica": "3.5", "fisica": "3.0", "corso di immatricolazione": null, "corso assegnato": "ELN1T3", "corso prenotato": null, "corsi in lista di attesa": null, "esito": "ASSEGNATO", "uri": "http://didattica.polito.it/pls/portal30/preimma.pkg_grad.ing?p_data=05/09/2017&p_a_acc=2018", "conting": 0, "grad_n": 0, "date": "2017-09-05", "logica e matematica": null, "cultura generale": null, "cultura del progetto": null, "territorio e soc.": null, "user": null, "ragionamento logico": null, "storia": null, "disegno e rappresentazione": null, "matematica e fisica": null, "corso/i in lista di attesa": null, "comprensione del testo": null, "fisica e matematica": null, "conoscenze acquisite negli studi": null, "corso unico": null, "conoscenze tecniche": null, "supercorso": "INGEGNERIA"}, {"corso": "ELN1T3", "week": 0, "month": "09", "year": 2019, "first_scorr": 0, "last_scorr": 0, "people_n": 148, "min_tot": 47.02, "matr": "F290436", "Unnamed: 0": 83482, "af user": "F290436", "totale": 47.02, "matematica": "12.0", "comp.del testo": "3.50", "logica": "3.5", "fisica": "0.75", "corso di immatricolazione": null, "corso assegnato": null, "corso prenotato": "ELN1T3", "corsi in lista di attesa": "MATEMATICA PER L'INGEGNERIA INGEGNERIA FISICA", "esito": "PRENOTATO", "uri": "http://didattica.polito.it/pls/portal30/preimma.pkg_grad.ing?p_data=04/09/2018&p_a_acc=2019", "conting": 0, "grad_n": 0, "date": "2018-09-04", "logica e matematica": null, "cultura generale": null, "cultura del progetto": null, "territorio e soc.": null, "user": null, "ragionamento logico": null, "storia": null, "disegno e rappresentazione": null, "matematica e fisica": null, "corso/i in lista di attesa": null, "comprensione del testo": null, "fisica e matematica": null, "conoscenze acquisite negli studi": null, "corso unico": null, "conoscenze tecniche": null, "supercorso": "INGEGNERIA"}, {"corso": "ELN1T3", "week": 0, "month": "09", "year": 2020, "first_scorr": 0, "last_scorr": 0, "people_n": 151, "min_tot": 48.81, "matr": "F334438", "Unnamed: 0": 207134, "af user": "F334438", "totale": 48.81, "matematica": "12.0", "comp.del testo": "4.75", "logica": "1.0", "fisica": "2.75", "corso di immatricolazione": null, "corso assegnato": null, "corso prenotato": "ELN1T3", "corsi in lista di attesa": "INGEGNERIA INFORMATICA", "esito": "PRENOTATO", "uri": "http://didattica.polito.it/pls/portal30/preimma.pkg_grad.ing?p_data=03/09/2019&p_a_acc=2020", "conting": 0, "grad_n": 0, "date": "2019-09-03", "logica e matematica": null, "cultura generale": null, "cultura del progetto": null, "territorio e soc.": null, "user": null, "ragionamento logico": null, "storia": null, "disegno e rappresentazione": null, "matematica e fisica": null, "corso/i in lista di attesa": null, "comprensione del testo": null, "fisica e matematica": null, "conoscenze acquisite negli studi": null, "corso unico": null, "conoscenze tecniche": null, "supercorso": "INGEGNERIA"}, {"corso": "ELN1T3", "week": 0, "month": "09", "year": 2021, "first_scorr": 0, "last_scorr": 0, "people_n": 168, "min_tot": 42.86, "matr": "F371244", "Unnamed: 0": 304042, "af user": "F371244", "totale": 42.86, "matematica": "9.25", "comp.del testo": "3.50", "logica": "0.0", "fisica": "5.25", "corso di immatricolazione": null, "corso assegnato": null, "corso prenotato": "ELN1T3", "corsi in lista di attesa": "INGEGNERIA INFORMATICA", "esito": "PRENOTATO", "uri": "http://didattica.polito.it/pls/portal30/preimma.pkg_grad.ing?p_data=01/09/2020&p_a_acc=2021", "conting": 0, "grad_n": 0, "date": "2020-09-01", "logica e matematica": null, "cultura generale": null, "cultura del progetto": null, "territorio e soc.": null, "user": null, "ragionamento logico": null, "storia": null, "disegno e rappresentazione": null, "matematica e fisica": null, "corso/i in lista di attesa": null, "comprensione del testo": null, "fisica e matematica": null, "conoscenze acquisite negli studi": null, "corso unico": null, "conoscenze tecniche": null, "supercorso": "INGEGNERIA"}, {"corso": "ELN1T3", "week": 0, "month": "09", "year": 2022, "first_scorr": 0, "last_scorr": 0, "people_n": 211, "min_tot": 45.83, "matr": "F438452", "Unnamed: 0": 37917, "af user": "F438452", "totale": 45.83, "matematica": "11,75", "comp.del testo": "4,75", "logica": "-0,25", "fisica": "3", "corso di immatricolazione": null, "corso assegnato": null, "corso prenotato": null, "corsi in lista di attesa": null, "esito": "PRENOTATO", "uri": "http://didattica.polito.it/pls/portal30/preimma.pkg_grad.ing_sep?p_data=07/09/2021&p_a_acc=2022&p_mnemo=ELN1T3", "conting": 0, "grad_n": 0, "date": "2021-09-07", "logica e matematica": null, "cultura generale": null, "cultura del progetto": null, "territorio e soc.": null, "user": null, "ragionamento logico": null, "storia": null, "disegno e rappresentazione": null, "matematica e fisica": null, "corso/i in lista di attesa": null, "comprensione del testo": null, "fisica e matematica": null, "conoscenze acquisite negli studi": null, "corso unico": "ELN1T3", "conoscenze tecniche": null, "supercorso": "INGEGNERIA"}, {"corso": "ELN1T3", "week": 0, "month": "09", "year": 2023, "first_scorr": 0, "last_scorr": 0, "people_n": 252, "min_tot": 35.12, "matr": "F451479", "Unnamed: 0": 128537, "af user": "F451479", "totale": 35.12, "matematica": "7,5", "comp.del testo": "3,25", "logica": null, "fisica": "1,25", "corso di immatricolazione": null, "corso assegnato": null, "corso prenotato": null, "corsi in lista di attesa": null, "esito": "PRENOTATO", "uri": "http://didattica.polito.it/pls/portal30/preimma.pkg_grad.ing_sep?p_data=06/09/2022&p_a_acc=2023&p_mnemo=ELN1T3", "conting": 0, "grad_n": 0, "date": "2022-09-06", "logica e matematica": null, "cultura generale": null, "cultura del progetto": null, "territorio e soc.": null, "user": null, "ragionamento logico": null, "storia": null, "disegno e rappresentazione": null, "matematica e fisica": null, "corso/i in lista di attesa": null, "comprensione del testo": null, "fisica e matematica": null, "conoscenze acquisite negli studi": null, "corso unico": "ELN1T3", "conoscenze tecniche": "2,75", "supercorso": "INGEGNERIA"}, {"corso": "ELN1T3", "week": 0, "month": "09", "year": 2024, "first_scorr": 0, "last_scorr": 0, "people_n": 243, "min_tot": 38.69, "matr": "F507841", "Unnamed: 0": 221810, "af user": "F507841", "totale": 38.69, "matematica": "7,25", "comp.del testo": "3", "logica": null, "fisica": "2", "corso di immatricolazione": null, "corso assegnato": null, "corso prenotato": null, "corsi in lista di attesa": null, "esito": "PRENOTATO", "uri": "http://didattica.polito.it/pls/portal30/preimma.pkg_grad.ing_sep?p_data=05/09/2023&p_a_acc=2024&p_mnemo=ELN1T3", "conting": 0, "grad_n": 0, "date": "2023-09-05", "logica e matematica": null, "cultura generale": null, "cultura del progetto": null, "territorio e soc.": null, "user": null, "ragionamento logico": null, "storia": null, "disegno e rappresentazione": null, "matematica e fisica": null, "corso/i in lista di attesa": null, "comprensione del testo": null, "fisica e matematica": null, "conoscenze acquisite negli studi": null, "corso unico": "ELN1T3", "conoscenze tecniche": "4", "supercorso": "INGEGNERIA"}, {"corso": "ELT1T1", "week": 0, "month": "09", "year": 2018, "first_scorr": 0, "last_scorr": 0, "people_n": 100, "min_tot": 35.12, "matr": "F279960", "Unnamed: 0": 3073, "af user": "F279960", "totale": 35.12, "matematica": "8.5", "comp.del testo": "3.50", "logica": "0.0", "fisica": "2.75", "corso di immatricolazione": null, "corso assegnato": null, "corso prenotato": "ELT1T1", "corsi in lista di attesa": "INGEGNERIA MECCANICA INGEGNERIA INFORMATICA INGEGNERIA ELETTRONICA INGEGNERIA GESTIONALE", "esito": "PRENOTATO", "uri": "http://didattica.polito.it/pls/portal30/preimma.pkg_grad.ing?p_data=05/09/2017&p_a_acc=2018", "conting": 0, "grad_n": 0, "date": "2017-09-05", "logica e matematica": null, "cultura generale": null, "cultura del progetto": null, "territorio e soc.": null, "user": null, "ragionamento logico": null, "storia": null, "disegno e rappresentazione": null, "matematica e fisica": null, "corso/i in lista di attesa": null, "comprensione del testo": null, "fisica e matematica": null, "conoscenze acquisite negli studi": null, "corso unico": null, "conoscenze tecniche": null, "supercorso": "INGEGNERIA"}, {"corso": "ELT1T1", "week": 0, "month": "09", "year": 2019, "first_scorr": 0, "last_scorr": 0, "people_n": 96, "min_tot": 42.26, "matr": "F301908", "Unnamed: 0": 84253, "af user": "F301908", "totale": 42.26, "matematica": "11.0", "comp.del testo": "0.00", "logica": "6.0", "fisica": "0.75", "corso di immatricolazione": null, "corso assegnato": null, "corso prenotato": "ELT1T1", "corsi in lista di attesa": "INGEGNERIA INFORMATICA INGEGNERIA INFORMATICA (COMPUTER ENGINEERING) INGEGNERIA GESTIONALE INGEGNERIA GESTIONALE INGEGNERIA ELETTRONICA", "esito": "PRENOTATO", "uri": "http://didattica.polito.it/pls/portal30/preimma.pkg_grad.ing?p_data=04/09/2018&p_a_acc=2019", "conting": 0, "grad_n": 0, "date": "2018-09-04", "logica e matematica": null, "cultura generale": null, "cultura del progetto": null, "territorio e soc.": null, "user": null, "ragionamento logico": null, "storia": null, "disegno e rappresentazione": null, "matematica e fisica": null, "corso/i in lista di attesa": null, "comprensione del testo": null, "fisica e matematica": null, "conoscenze acquisite negli studi": null, "corso unico": null, "conoscenze tecniche": null, "supercorso": "INGEGNERIA"}, {"corso": "ELT1T1", "week": 0, "month": "09", "year": 2020, "first_scorr": 0, "last_scorr": 0, "people_n": 61, "min_tot": 45.24, "matr": "F319528", "Unnamed: 0": 207735, "af user": "F319528", "totale": 45.24, "matematica": "12.75", "comp.del testo": "3.00", "logica": "0.75", "fisica": "2.5", "corso di immatricolazione": null, "corso assegnato": "ELT1T1", "corso prenotato": null, "corsi in lista di attesa": null, "esito": "ASSEGNATO", "uri": "http://didattica.polito.it/pls/portal30/preimma.pkg_grad.ing?p_data=03/09/2019&p_a_acc=2020", "conting": 0, "grad_n": 0, "date": "2019-09-03", "logica e matematica": null, "cultura generale": null, "cultura del progetto": null, "territorio e soc.": null, "user": null, "ragionamento logico": null, "storia": null, "disegno e rappresentazione": null, "matematica e fisica": null, "corso/i in lista di attesa": null, "comprensione del testo": null, "fisica e matematica": null, "conoscenze acquisite negli studi": null, "corso unico": null, "conoscenze tecniche": null, "supercorso": "INGEGNERIA"}, {"corso": "ELT1T1", "week": 0, "month": "09", "year": 2021, "first_scorr": 0, "last_scorr": 0, "people_n": 110, "min_tot": 40.48, "matr": "F365046", "Unnamed: 0": 304338, "af user": "F365046", "totale": 40.48, "matematica": "9.5", "comp.del testo": "2.00", "logica": "2.5", "fisica": "3.0", "corso di immatricolazione": null, "corso assegnato": "ELT1T1", "corso prenotato": null, "corsi in lista di attesa": null, "esito": "ASSEGNATO", "uri": "http://didattica.polito.it/pls/portal30/preimma.pkg_grad.ing?p_data=01/09/2020&p_a_acc=2021", "conting": 0, "grad_n": 0, "date": "2020-09-01", "logica e matematica": null, "cultura generale": null, "cultura del progetto": null, "territorio e soc.": null, "user": null, "ragionamento logico": null, "storia": null, "disegno e rappresentazione": null, "matematica e fisica": null, "corso/i in lista di attesa": null, "comprensione del testo": null, "fisica e matematica": null, "conoscenze acquisite negli studi": null, "corso unico": null, "conoscenze tecniche": null, "supercorso": "INGEGNERIA"}, {"corso": "ELT1T1", "week": 0, "month": "09", "year": 2022, "first_scorr": 0, "last_scorr": 0, "people_n": 115, "min_tot": 41.67, "matr": "F417485", "Unnamed: 0": 35763, "af user": "F417485", "totale": 41.67, "matematica": "10,5", "comp.del testo": "4,75", "logica": "1,25", "fisica": "1", "corso di immatricolazione": null, "corso assegnato": null, "corso prenotato": null, "corsi in lista di attesa": null, "esito": "PRENOTATO", "uri": "http://didattica.polito.it/pls/portal30/preimma.pkg_grad.ing_sep?p_data=07/09/2021&p_a_acc=2022&p_mnemo=ELT1T1", "conting": 0, "grad_n": 0, "date": "2021-09-07", "logica e matematica": null, "cultura generale": null, "cultura del progetto": null, "territorio e soc.": null, "user": null, "ragionamento logico": null, "storia": null, "disegno e rappresentazione": null, "